Category,Message,,,
ham,Is that seriously how you spell his name?,,,
spam,"FREE RINGTONE text FIRST to 87131 for a poly or text GET to 87131 for a true tone! Help? 0845 2814032 16 after 1st free, tones are 3xŻ150pw to eŻnd txt stop",,,
spam,"Hello darling how are you today? I would love to have a chat, why dont you tell me what you look like and what you are in to sexy?",,,
ham,Good. No swimsuit allowed :),,,
ham,"SYMPTOMS when U are in love: ""1.U like listening songs 2.U get stopped where u see the name of your beloved 3.U won't get angry when your",,,
ham,"I'm a guy, browsin is compulsory",,,
spam,"Gr8 Poly tones 4 ALL mobs direct 2u rply with POLY TITLE to 8007 eg POLY BREATHE1 Titles: CRAZYIN, SLEEPINGWITH, FINEST, YMCA :getzed.co.uk POBox365O4W45WQ 300p",,,
ham,"Yeah, that's fine! It's Ż6 to get in, is that ok?",,,
ham,Desires- u going to doctor 4 liver. And get a bit stylish. Get ur hair managed. Thats it.,,,
spam,Burger King - Wanna play footy at a top stadium? Get 2 Burger King before 1st Sept and go Large or Super with Coca-Cola and walk out a winner,,,
ham,"Single line with a big meaning::::: ""Miss anything 4 ur ""Best Life"" but, don't miss ur best life for anything... Gud nyt...",,,
ham,K.then any other special?,,,
ham,Is she replying. Has boye changed his phone number,,,
ham,"I can't speak, bcaz mobile have problem. I can listen you but you cann't listen my voice. So i calls you later.",,,
ham,I like dis sweater fr mango but no more my size already so irritating.,,,
spam,TBS/PERSOLVO. been chasing us since Sept forŻ38 definitely not paying now thanks to your information. We will ignore them. Kath. Manchester.,,,
spam,Great News! Call FREEFONE 08006344447 to claim your guaranteed Ż1000 CASH or Ż2000 gift. Speak to a live operator NOW!,,,
ham,"Ok, be careful ! Don't text and drive !",,,
spam,Please call our customer service representative on FREEPHONE 0808 145 4742 between 9am-11pm as you have WON a guaranteed Ż1000 cash or Ż5000 prize!,,,
ham,"Goodmorning, today i am late for 2hrs. Because of back pain.",,,
ham,K..k..any special today?,,,
ham,No no. I will check all rooms befor activities,,,
ham,is class canceled today,,,
spam,Someone U know has asked our dating service 2 contact you! Cant Guess who? CALL 09058091854 NOW all will be revealed. PO BOX385 M6 6WU,,,
ham,"Cool, text me when you're ready",,,
spam,"URGENT, IMPORTANT INFORMATION FOR O2 USER. TODAY IS YOUR LUCKY DAY! 2 FIND OUT WHY LOG ONTO HTTP://WWW.URAWINNER.COM THERE IS A FANTASTIC SURPRISE AWAITING FOR YOU",,,
ham,Got it..mail panren paru..,,,
ham,Your opinion about me? 1. Over 2. Jada 3. Kusruthi 4. Lovable 5. Silent 6. Spl character 7. Not matured 8. Stylish 9. Simple Pls reply..,,,
ham,Sorry da. I gone mad so many pending works what to do.,,,
spam,EASTENDERS TV Quiz. What FLOWER does DOT compare herself to? D= VIOLET E= TULIP F= LILY txt D E or F to 84025 NOW 4 chance 2 WIN Ż100 Cash WKENT/150P16+,,,
ham,Tell them the drug dealer's getting impatient,,,
spam,Collect your VALENTINE'S weekend to PARIS inc Flight & Hotel + Ż200 Prize guaranteed! Text: PARIS to No: 69101. www.rtf.sphosting.com,,,
ham,His bday real is in april .,,,
spam,"You are being contacted by our dating service by someone you know! To find out who it is, call from a land line 09050000878. PoBox45W2TG150P",,,
ham,His bday real is in april .,,,
ham,"Short But Cute : "" Be a good person , but dont try to prove"" ..... Gud mrng...",,,
ham,"Sorry, I'll call you  later. I am in meeting sir.",,,
ham,X2  &lt;#&gt; . Are you going to get that,,,
ham,That's y u haf 2 keep me busy...,,,
spam,EASTENDERS TV Quiz. What FLOWER does DOT compare herself to? D= VIOLET E= TULIP F= LILY txt D E or F to 84025 NOW 4 chance 2 WIN Ż100 Cash WKENT/150P16+,,,
ham,And do you have any one that can teach me how to ship cars.,,,
ham,Omg if its not one thing its another. My cat has worms :/ when does this bad day end?,,,
spam,"FreeMsg: Claim ur 250 SMS messages-Text OK to 84025 now!Use web2mobile 2 ur mates etc. Join Txt250.com for 1.50p/wk. T&C BOX139, LA32WU. 16 . Remove txtX or stop",,,
ham,"It's wylie, you in tampa or sarasota?",,,
spam,Your unique user ID is 1172. For removal send STOP to 87239 customer services 08708034412,,,
spam,http//tms. widelive.com/index. wml?id=820554ad0a1705572711&first=trueĪC C RingtoneĪ,,,
spam,"Hungry gay guys feeling hungry and up 4 it, now. Call 08718730555 just 10p/min. To stop texts call 08712460324 (10p/min)",,,
spam,You are a winner you have been specially selected to receive Ż1000 cash or a Ż2000 award. Speak to a live operator to claim call 087123002209am-7pm. Cost 10p,,,
ham,S:)but he had some luck.2 catches put down:),,,
spam,Free entry in 2 a wkly comp to win FA Cup final tkts 21st May 2005. Text FA to 87121 to receive entry question(std txt rate)T&C's apply 08452810075over18's,,,
spam,#ERROR!,,,
ham,"Thank You for calling.Forgot to say Happy Onam to you Sirji.I am fine here and remembered you when i met an insurance person.Meet You in Qatar Insha Allah.Rakhesh, ex Tata AIG who joined TISSCO,Tayseer.",,,
spam,You are a winner U have been specially selected 2 receive Ż1000 or a 4* holiday (flights inc) speak to a live operator 2 claim 0871277810910p/min (18+),,,
ham,Wat time u finish ur lect today?,,,
ham,"Tonight? Yeah, I'd be down for that",,,
ham,"What do u reckon as need 2 arrange transport if u can't do it, thanks",,,
spam,You have won a guaranteed Ż200 award or even Ż1000 cashto claim UR award call free on 08000407165 (18+) 2 stop getstop on 88222 PHP,,,
spam,URGENT! We are trying to contact U. Todays draw shows that you have won a Ż800 prize GUARANTEED. Call 09050001808 from land line. Claim M95. Valid12hrs only,,,
spam,Great News! Call FREEFONE 08006344447 to claim your guaranteed Ż1000 CASH or Ż2000 gift. Speak to a live operator NOW!,,,
ham,O was not into fps then.,,,
ham,I'm gonna rip out my uterus.,,,
ham,"Mum, hope you are having a great day. Hoping this text meets you well and full of life. Have a great day. Abiola",,,
ham,I cant pick the phone right now. Pls send a message,,,
ham,His bday real is in april .,,,
spam,Bored housewives! Chat n date now! 0871750.77.11! BT-national rate 10p/min only from landlines!,,,
ham,Pls she needs to dat slowly or she will vomit more.,,,
ham,Cuz ibored. And don wanna study,,,
spam,"Thanks for your ringtone order, ref number K718. Your mobile will be charged Ż4.50. Should your tone not arrive please call customer services on 09065069120",,,
ham,Ok. No wahala. Just remember that a friend in need ...,,,
ham,"I'm there and I can see you, but you can't see me ? Maybe you should reboot ym ? I seen the buzz",,,
spam,Hi if ur lookin 4 saucy daytime fun wiv busty married woman Am free all next week Chat now 2 sort time 09099726429 JANINExx CallsŻ1/minMobsmoreLKPOBOX177HP51FL,,,
spam,from www.Applausestore.com MonthlySubscription@50p/msg max6/month T&CsC web age16 2stop txt stop,,,
ham,S...from the training manual it show there is no tech process:)its all about password reset and troubleshooting:),,,
ham,No. Yes please. Been swimming?,,,
ham,"That's cool, I'll come by like  &lt;#&gt; ish",,,
spam,"You are guaranteed the latest Nokia Phone, a 40GB iPod MP3 player or a Ż500 prize! Txt word: COLLECT to No: 83355! IBHltd LdnW15H 150p/Mtmsgrcvd18",,,
ham,"YEH I AM DEF UP4 SOMETHING SAT,JUST GOT PAYED2DAY & I HAVBEEN GIVEN AŻ50 PAY RISE 4MY WORK & HAVEBEEN MADE PRESCHOOLCO-ORDINATOR 2I AM FEELINGOOD LUV",,,
ham,He said i look pretty wif long hair wat. But i thk he's cutting quite short 4 me leh.,,,
spam,Message Important information for O2 user. Today is your lucky day! 2 find out why log onto http://www.urawinner.com there is a fantastic surprise awaiting you,,,
ham,"Wishing you and your family Merry ""X"" mas and HAPPY NEW Year in advance..",,,
spam,December only! Had your mobile 11mths+? You are entitled to update to the latest colour camera mobile for Free! Call The Mobile Update Co FREE on 08002986906,,,
ham,Ok.,,,
spam,Had your mobile 11mths ? Update for FREE to Oranges latest colour camera mobiles & unlimited weekend calls. Call Mobile Upd8 on freefone 08000839402 or 2StopTx,,,
spam,You are being ripped off! Get your mobile content from www.clubmoby.com call 08717509990 poly/true/Pix/Ringtones/Games six downloads for only 3,,,
ham,"Damn, can you make it tonight or do you want to just wait til tomorrow",,,
ham,Honestly i've just made a lovely cup of tea and promptly dropped my keys in it and then burnt my fingers getting them out!,,,
ham,Haha... can... But i'm having dinner with my cousin...,,,
ham,No one interested. May be some business plan.,,,
ham,His bday party is on friday .,,,
ham,Yes:)sura in sun tv.:)lol.,,,
ham,My uncles in Atlanta. Wish you guys a great semester.,,,
ham,K:)k:)good:)study well.,,,
spam,We tried to contact you re your reply to our offer of a Video Handset? 750 anytime any networks mins? UNLIMITED TEXT? Camcorder? Reply or call 08000930705 NOW,,,
spam,Well done ENGLAND! Get the official poly ringtone or colour flag on yer mobile! text TONE or FLAG to 84199 NOW! Opt-out txt ENG STOP. Box39822 W111WX Ż1.50,,,
ham,"My planning usually stops at ""find hella weed, smoke hella weed""",,,
ham,"Nah, Wednesday. When should I bring the mini Cheetos bag over?",,,
ham,"Okay, thatÆs great. Thanks a lot.",,,
ham,"ItÆs so common hearing ōHow are you? What are you doing? How was your day?ö So let me ask you something different. Did you smile today? If not, do it now. Good evening.",,,what are you doing?
ham,Hmmģ my uncle just informed me that heÆs paying the school directly. So please buy food.,,,
ham,You're sickŚcan you still go shopping?,,,
ham,Looks like you found something else to do besides smoke. Great job!,,,
spam,"Thanks for your ringtone order, Reference T91. You will be charged GBP 4 per week. You can unsubscribe anytime by calling customer services at 09057039994.",,,
spam,"ōShop Till You Dropö: Is it you? Win either Ż10,000, Ż5,000, Ż500 cash, or a Ż100 travel voucher. Call now: 09064011000. NTT PO Box CR01327BT. Fixed line cost 150ppm, mobile rates vary.",,,
spam,Four months half-price Orange line rental and the latest camera phones for free. Had your phone for 11 months? Call MobilesDirect free at 08000938767 to update now! Or text STOP to unsubscribe.,,,
spam,"Not heard from you for a while. Call for private chat on 01223585334. If you want to receive photo content, text PIX to 8552. To stop messages, send STOP to 8552. ¢SAM",,,
ham,Great to hear you are settling well. So whatÆs happening with Ola?,,,
ham,"That call cost Ż1.20, which I guess isnÆt bad. Mom is sick cough cough",,,
ham,kyhkl;',,,
spam,Congratulations! You are awarded either Ż500 of CD gift vouchers and free entry to our Ż100 weekly draw. Text MUSIC to 87066. T&Cs at www.Ldew.com. One winner. 150ppm. Age 16+.,,,
ham,"I like to talk, but IÆm not able to. I donÆt know why.",,,
ham,"I think youÆve got to go home by yourself, because IÆll be going out shopping for my friendÆs present.",,,
ham,"No, my blankets are sufficient. Thanks.",,,
spam,Free first-week entry to TEXTPOD for a chance to win a 40GB iPod or Ż250 cash every week. Text POD to 84128. T&Cs at www.textpod.net. Customer care: 08712405020.,,,
spam,PRIVATE! Your 2003 account statement for <phone number> shows 800 unredeemed SIM points. Call 08715203656. Identifier Code: 42049. Expires 26/10/04.,,,
ham,ID only matters when getting on from off-campus.,,,
ham,"Carlos says we can pick up from him later, so yeah, we're set.",,,
spam,Four months half-price Orange line rental and the latest camera phones free. Had your phone for 11 months? Call MobilesDirect free on 08000938767 to update now! Or text STOP.,,,
ham,Okayģ you finishing soon?,,,
spam,Sorry! You cannot unsubscribe yet. The MOB offer package has a minimum term of 54 weeks. Please resubmit your request after expiry. Reply ōTHEMOB HELPö for more info.,,,
ham,So IÆm doing a list of buyers.,,,
ham,"Whatever relationships you build in this world, the only thing that remains at last is loneliness with lots and lots of memories. Feelingģ",,,
spam,"Call 09094100151 to use your minutes! Calls cost 10p/min (mobile rates vary). Service provided by AOM. Just GBP 5/month. AOM Box 61, M60 1ER until you stop. Ages 18+ only.",,,
ham,"Awesome, plan to get here anytime after <#>. IÆll text you the details in a little bit.",,,
ham,"Sorry, I guess whenever I can get hold of my connectionsŚmaybe an hour or twoŚIÆll text you",,,
spam,Free message: Thank you for using the Auction Subscription Service. Messages cost 150p. To skip an auction text OUT. To unsubscribe text STOP. Customer Care: 08718726270.,,,
spam,"Goldviking is inviting you to be his friend. Reply YES-762 or NO-762. See his profile at SMS.ac. To stop, text STOP FRND to 62468.",,,
ham,"Please call me. If there has been any mistake on my side, I apologise. Please go to the doctor.",,,
ham,IÆm not sure if it supports those formats. I think the PS3 can play through USB as well.,,,
ham,"Dear, I have reached the room.",,,
ham,Shuhui has bought RonÆs present Ś itÆs a Swatch watch.,,,
ham,You did fine already. Are you at NYDC at Wheelock?,,,
ham,ItÆs good. When are you going?,,,
ham,How have your little ones been this week? Need a coffee run tomorrow? CanÆt believe itÆs already that time of the week.,,,
ham,Then you canÆt get the laptop? My matric card is with you.,,,
ham,"You go ahead shopping, I have things to do. Do you want to watch ōInfernal Affairsö? Come along if you like.",,,
ham,Will you be here for food?,,,
spam,You have received your mobile content. Enjoy.,,,
ham,Thinking about you.,,,
ham,Meet after lunch.,,,
ham,Do you know where my lab goggles went?,,,
spam,You have a secret admirer who wants to make contact with you. Call 09058094565 to discover who it is.,,,
ham,"A thoughtful message: ōOur heart feels light when someone is present, but it feels heavy when someone leaves.ö Good morning.",,,
ham,"ōLove fills the heart, wisdom fills the mind, dreams fill the eyes, and friends fill life.ö Always stay in touch. Good night and pleasant dreams.",,,
spam,"New ringtone selections this week include: McFly, Sara Jorge, and Will Smith. Follow the instructions in the next message to order.",,,
ham,"Did you get the dental work done? If not, please handle it as soon as possible. Take care.",,,
ham,That sounds great. I might take you up on that. What are your plans tonight?,,,
spam,Enhance your phone with a Halloween collection of logos and pictures plus a free ringtone. Text CARD SPOOK to 8007.,,,
spam,Win a Ż1000 cash prize or a prize worth Ż5000.,,,
ham,Are you at the pub?,,,
spam,"Goal update: Arsenal 4 vs Liverpool 2. Henry scores with a simple shot from 6 yards after a pass from Bergkamp, giving Arsenal a lead after 78 minutes.",,,
ham,"You havenÆt lost me. I will continue to be here for you. I didnÆt intend to cause any hurt. I didnÆt realise how you felt when I was away, and thatÆs what I tried to explain. I care about you.",,,
spam,Knock Knock! Text ōwhoÆs thereö to 80082 to enter the weekly draw for a Ż250 gift voucher. T&Cs apply.,,,
ham,"That was random. By the way, is it your lunch break?",,,
spam,You have been selected to receive a Ż2000 award. Call 08712402050 before the lines close. Cost 10ppm. 16+. Terms apply.,,,
ham,What are you not understanding?,,,
spam,"SMS Auction: You have won a Nokia 7250i in our free auction. To participate, text NOKIA to 86021. Terms apply.",,,
spam,You have been invited to XCHAT. This is our final attempt to contact you. Text CHAT to 86688.,,,
ham,"Do you know what real friendship is? IÆll give you an example: even if this message is intentionally misspelled, you can still read it Ś thatÆs how understanding works. Good night and sleep well.",,,
spam,Urgent: Please call 09066612661 from your landline. Your complimentary 4-star Costa Del Sol holiday or Ż1000 cash awaits collection. Terms apply.,,,
ham,Good afternoon. How is your day going? Any progress with job prospects? I hope you are well.,,,
ham,Please come around at <TIME>.,,,
spam,Romantic Paris: Two nights and two flights from Ż79. Book now for next year. Call 08704439680. Terms apply.,,,
ham,"I printed out a forum post from someone with the same issue, which was resolved with a GPU replacement. Hopefully they donÆt ignore that.",,,
spam,Customer service announcement: You have a New YearÆs delivery waiting. Please call 07046744435 to arrange delivery.,,,
ham,"Hello, hope your day is going well. I hope you are healthy and that you find some good job opportunities.",,,
ham,Do you enjoy swimming? I have a pool and jacuzzi at my place.,,,
ham,Ok...,,,
ham,When are you taking your practical lessons? I start mine in June.,,,
ham,Please come home soon. I have prepared food.,,,
ham,How are you today? Are you working hard? I couldnÆt sleep last night and almost called you early.,,,
spam,You have an important customer service announcement. Call FREEPHONE 0800 542 0825 now.,,,
ham,IÆve reached home and finished bathing. You can call me now.,,,
ham,How was texting and driving?,,,
spam,"Christmas Offer! Latest Motorola, SonyEricsson & Nokia with free Bluetooth or DVD. Double minutes & 1000 texts on Orange. Call MobileUpd8 on 08000839402 or call2optout/4QF2",,,
ham,"Ok, I will not call or disturb anyone. I know everyone is avoiding me. I feel like a burden.",,,
ham,G.W.R,,,
spam,Today's Voda numbers ending with 7634 are selected to receive a Ż350 reward. If you have a match please call 08712300220 quoting claim code 7684.,,,
ham,Was the actual exam harder than the NBME?,,,
spam,SMS AUCTION ¢ A brand new Nokia 7250 is available today! Free to join. Text NOKIA to 86021 now!,,,
spam,"You can stop further club tones by replying ""STOP MIX."" Terms at my-tone.com/enjoy.",,,
ham,Is there a way you can send ShadeÆs items to her? She has been very helpful.,,,
ham,"Let me know the details for Friday when you find out, since I won't be in tomorrow or Friday. Mentioned Chinese. Thanks.",,,
ham,Hope you are feeling well. Please update me. ŚAbiola,,,
ham,"It was a nice day and I was sensible, went home early, and now feel fine. When is your schedule? I canÆt remember.",,,
ham,"Hello, I hope your day goes well. Did you sleep in? Looking forward to meeting again.",,,
spam,Free message: A service you ordered from 81303 could not be delivered due to insufficient credit. Please top up to receive it.,,,
ham,"Well, at least you didnÆt actually call someone that name. That would have been worse.",,,
ham,We will sell everything so we will have many coins. Then we can sell our coins through PayPal. Extra money in our pockets!,,,
spam,IMPORTANT MESSAGE. This is a final contact attempt. You have important messages waiting in our customer claims department. Call 08717507382 NOW.,,,
spam,Chat and social service now! 0871750.77.11. BT national rate 10p/min from landlines.,,,
ham,"Great, let me know whenever you're nearby.",,,
ham,Heading toward the bus stop.,,,
spam,"You have won Ż1,000 cash or a Ż2,000 prize! To claim, call 09050000327. Terms: RSTM, SW7 3SS. 150ppm.",,,
ham,Uncle Abbey! Happy New Year. ŚAbiola,,,
ham,Good night. Take care. Practice is ongoing.,,,
ham,"I will call you later, I donÆt have network. If urgent, send a message.",,,
spam,Free Msg: Ringtone available at the provided link.,,,
ham,Probably financial worries. Payments are due and I have several outstanding invoices for work completed months ago.,,,
ham,I will call now. I am having food.,,,
ham,Message: some text missing. Sender name missing. Number missing. Date missing. Sent via fullonsms.com.,,,
spam,Double your minutes and texts on Orange or get half-price rental. Free phones. Call MobileUpd8 on 08000839402 or 2optout/HV9D.,,,
ham,Ok. I will treat you with professionalism and respect.,,,
spam,YOU HAVE WON! As a valued Vodafone customer you have been selected to win a Ż150 prize. Call 09061743386 to collect.,,,
ham,I will meet you in the lobby.,,,
ham,I am surprised you havenÆt gone to the internet cafe yet. I expected to hear from you.,,,
ham,"No rush, I will ask Jay.",,,
ham,I uploaded mine to Facebook.,,,
ham,"Hi, mobile number <#> has added you to their contacts on fullonsms.com. Visit fullonsms.com for more.",,,
ham,"DipÆs phone is off. I am coming with him. Please respond, otherwise we will return.",,,
spam,"Thank you for your ringtone order, reference X49. Your mobile will be charged Ż4.50. If it does not arrive, please call customer services 09065989182.",,,
spam,"Someone you know is trying to contact you via our dating service. To find out who, call 09064015307 BOX334SK38ch.",,,
spam,Do you want a new video phone with 750 minutes and 150 texts for only five pounds per week? Call 08000776320 now.,,,
spam,Today's Voda numbers ending 5226 are selected to receive a Ż350 award. If you have a match please call 08712300220 quoting code 1131.,,,
ham,I have reached home finally.,,,
spam,Want to meet new people tonight? Get real location updates sent directly to your mobile. Join the UK's largest social meetup network by texting GRAVEL to 69888. Charges apply.,,,
spam,Missed call from 08702490080. It asks you to call 09066358152 to claim a Ż5000 prize. Requires entering your personal details. Please be cautious.,,,
ham,I will be respectful and considerate.,,,
ham,Congratulations! Wishing you many positive moments ahead.,,,
spam,"You have won a Nokia 7250i in our free auction. To participate, text NOKIA to 86021 now. Terms apply.",,,
spam,This is our second attempt to contact you. You have won a Ż750 prize. Call 08718726970 now to claim. Standard charges apply.,,,
ham,"Just letting you know IÆm back at my parentsÆ place in South Tampa, so we may need to meet somewhere else.",,,
ham,"Sorry, IÆll call later. In a meeting.",,,
spam,"Your account balance is Ż500. To increase your payout, text GO to 86688. Charges apply.",,,
spam,URGENT! Your number has been awarded a Ż2000 guaranteed prize. Call 09058094455 to claim within 12 hours.,,,
ham,There are two bold items at <#>. Are they yours?,,,
ham,"IÆm still having coffee with my friends. My friend is driving, so sheÆll give me a lift.",,,
spam,You are awarded a City Break and could win a Ż200 shopping spree. Text STORE to 88039. Subscription charges apply.,,,
spam,Selected Vodafone numbers ending in 4882 may receive a Ż350 award. Call 09064019014 to claim.,,,
ham,"IÆm in the office. WhatÆs the matter? Message me now, I will call during my break.",,,
ham,IÆm back. Took long due to an accident on A30. Had to divert through Wadebridge. Had a good weekend. Talk soon.,,,
spam,Accommodation vouchers worth Ż450 available. Claim number 15541 required. Terms apply.,,,
ham,My tuition is at 3:30. Should we go for the 11:20 to 12:05 one? Is that okay for you?,,,
ham,"If I said anything wrong, IÆm sorry.",,,
ham,Alright! What are you doing tonight? Ended up not going downtownŚjust went to the pub. Relaxing in my room now.,,,
ham,Please donÆt joke around. Sleep early. Good night.,,,
spam,Had your mobile contract 11 months? Get latest phones free plus double minutes and texts. Text YES for callback or NO to unsubscribe.,,,
spam,Mobile Club: choose from top-quality items for your phone. Reference: 7cfca1a.,,,
ham,Are you calling me? Call my mobile phone.,,,
ham,Not sure I can arrange anything here. Let me know if you want me to drive down and meet.,,,
spam,Your 2003 account statement shows 800 unredeemed points. Call 08715203652 with code 42810. Expires soon.,,,
ham,Life is not always the same.,,,
ham,How are you? Are you okay?,,,
ham,"The housemaid is the suspect because the incident happened on <#> January, a public holiday when all institutions were closed. Understand?",,,
spam,Urgent! You are awarded a complimentary trip to EuroDisney or Ż1000. Text DIS to 87121. Charges apply.,,,
spam,"Urgent! Call 09066649731 to claim a complimentary Ibiza holiday or Ż10,000 cash. Terms apply.",,,
ham,Name your price as long as itÆs reasonable. When can I pick them up? You have exams?,,,
spam,You have won Ż1000 cash or a Ż2000 prize. Call 08714712412 between 10am¢7pm. Charges apply.,,,
spam,Win a year of CDs worth Ż500 and enter a Ż100 weekly draw. Text MUSIC to 87066. Subscription charges apply.,,,
ham,I talked a lot about Boston in my personal statement! I wouldÆve changed it if I noticed it said NYC. ItÆs updated now.,,,
ham,"No, he didnÆt. Spring is arriving early.",,,
ham,"Hi, can I please borrow <#> dollars? IÆll pay you back by mid-February.",,,
ham,"Got models from Fujitsu, IBM, HP, Toshibaģ many options available.",,,
spam,Want a laugh? Try CHIT-CHAT on your mobile. Text CHAT to 8883. Charges apply.,,,
spam,"Win a meet-and-greet with Westlife. Text 1, 2, or 3 to 83049. Charges apply.",,,
spam,Free weekly entry to win an iPod. Text POD to 80182. Standard rates apply.,,,
ham,I bought the test yesterday. It shows the date you need. YouÆll get it in 2¢3 weeks. Please donÆt worry; everything will be fine. Let me know if thereÆs anything important from your history.,,,
ham,Says the <#>-year-old with responsibilities. IÆm down to my last <#>. Still waiting for that check.,,,
spam,"For a chance to win a Ż250 weekly shopping spree, text SHOP to 80878. Charges apply.",,,
spam,Last weekendÆs draw shows you won Ż1000 guaranteed. Call 09064017295 with code K52.,,,
ham,I enjoy helping people relax. What style do you prefer? ,,,
spam,Here is your discount code: RP176781. Reply STOP to unsubscribe.,,,
ham,My friends used to say the same.,,,
spam,"Someone contacted our service and listed your number. To find out who, call 09058098002. Charges apply.",,,
spam,Win a year of CDs worth Ż500 and enter our weekly Ż100 draw. Text MUSIC to 87066. Subscription charges apply.,,,
spam,A link to your picture has been sent. You can also use the provided website link.,,,
ham,IÆve been seeing a lot of Corvettes lately.,,,
ham,Or approximately <#> minutes.,,,
