Category,Message,,,
spam,"Get your garden ready for summer with a free selection of summer bulbs and seeds worth Ż33.50, available only with The Scotsman this Saturday. To stop messages, visit notxt.co.uk.",,,
spam,"This is your chance to be on a reality fantasy show. Call now at 08707509020. The cost is 20p per minute. NTT Ltd, PO Box 1327, Croydon CR9 5WB. 0870 is a national-rate call.",,,
ham,"Love is not a decision; it is a feeling. If we could choose whom to love, life would be much simpler, but it would also be less magical.",,,
ham,"Good friends care for each other, close friends understand each other, and true friends remain foreverŚbeyond words and beyond time. Good night.",,,
ham,Good. Great job. I appreciate entrepreneurs.,,,
ham,"My parents, my children, my friends, and my colleagues all shouted, ōSurprise!ö",,,
spam,"You were outbid by simonwatson5120 on the Shinco DVD player. To bid again, visit sms.ac/smsrewards. To stop bid notifications, reply with END OUT.",,,
ham,"I will come tomorrow, sister.",,,
ham,"Hi, did you have a good day? Have you spoken to anyone since the weekend?",,,
ham,WhatÆs going on? Do you want me to come online?,,,
ham,"Hurt me, tease me, make me cryģ but at the end of my life, when I pass away, please keep one rose on my grave and say, ōI miss you.ö Have a nice day.",,,
spam,"Urgent! Your mobile number 077xxx has won a Ż2,000 Bonus Caller Prize on 02/06/03. This is the second attempt to contact you. Call 09066362206 as soon as possible. BOX97N7QP, 150ppm.",,,
ham,"Hi Priya, are you alright? What did the doctor say? Please reply. Where are you?",,,
ham,"Dear, how is your day going? What are you doing and where are you? I am sipping my cappuccino and thinking of you, my love. I send a kiss from across the sea.",,,
spam,Private! Your 2003 account statement for 07973788240 shows 800 unredeemed SIM points. Call 08715203649 with Identifier Code 40533. Expires 31/10/04.,,,
ham,"I think around 5:30, though IÆm not sure if we can get tickets. What are you doing now?",,,
ham,"I am on a train back from Northampton, so unfortunately I cannot. I took the day off today just to relax. I will be around on Wednesday. Do you want to go to the comedy club this week?",,,
ham,"Sorry, IÆll call later.",,,
ham,Ahh.. I forgot to call you will meet tomorrow.,,,
ham,"Not sure yet, still trying to get a hold of hiB21:B39m",,,
ham,"Sweetheart, hope you are not having that kind of day! Have one with loads of reasons to smile. ",,,
ham,I am on gloucesterroad what are you up to later?,,,
spam,"Eerie Nokia tones 4u, reply TONE TITLE to 8007 eg TONE DRACULA to 8007 Titles: GHOST, ADDAMSFA, MUNSTERS, EXORCIST, TWILIGHT www.getzed.co.uk POBox36504W45WQ 150p",,,
ham,"Camera quite good, 10.1mega pixels, 3optical and 5digital dooms. Have a lovely holiday, be safe and i hope you have a good journey! Happy new year to you both! See you in a couple of weeks!",,,
ham,Good Morning my Dear Shijutta........... Have a great &amp; successful day.,,,
spam,"Congrats! 1 year special cinema pass for 2 is yours. call 09061209465 now! C Suprman V, Matrix3, StarWars3, etc all 4 FREE! bx420-ip4-5we. 150pm. Dont miss out!",,,
spam,URGENT! Your account has been selected for a bonus. Contact us immediately,,,
ham,You seem really unfortunateģ Then you donÆt want to eat? Have you already taken a bath?,,,
ham,I am going to sleep. I am tired of travel.,,,
ham,I don't know jack shit about anything or i'd say/ask something helpful but if you want you can pretend that I did and just text me whatever in response.,,,
ham,Hi! You just spoke to MANEESHA V. We'd like to know if you were satisfied with the experience. Reply Toll Free with Yes or No.,,,
ham,Yeah get the unlimited cookies from my bakery.,,,
ham,Lol I know! They're so dramatic. Schools already closed for tomorrow. Apparently we can't drive in the inch of snow were supposed to get.,,,
spam,important information 4 orange user . today is your lucky day! To find out why log onto http://www.urawinner.com THERE'S A FANTASTIC SURPRISE AWAITING YOU!,,,
ham,Thank you for your stay in our hotel. Hope you visit other time.,,,
spam,Reply to win Ż100 weekly! What professional sport does Tiger Woods play? Send STOP to 87239 to end service,,,
ham,Yeah he got in at 2 and was very apologetic and had fallen out and she was acting like spoilt child and he got caught up in that. Till 2! But we won't go there! Not doing too badly cheers. You?,,,
ham,Yes but mostly not like that.,,,
ham,Hey come online for minecraft game! We are all there,,,
ham,Ok... you enjoy your shows...,,,
spam,"Exclusive offer: Travel, hotel stays, or flight deals available now. Call immediately",,,
spam,"WIN: We have a winner! Mr. T. Foley won an iPod! More exciting prizes soon, so keep an eye on your mobile or visit www.win-82050.co.uk",,,
spam,You will be receiving this week's Triple Echo ringtone shortly. Enjoy it!,,,
ham,my parents are out for an event.. Wanna have a friends day out now.,,,
ham,"Sorry, I'll call later",,,
ham,Friends that you can stay on fb chat with ,,,
spam,"FREE MESSAGE Activate your 500 FREE Text Messages by replying to this message with the word FREE For terms & conditions, visit www.07781482378.com",,,
ham,Yar lor actually we quite fast... Cos da ge slow wat... Haha...,,,
ham,Merry christmas to u too annie!,,,
spam,PRIVATE! Your 2003 Account Statement for 07808247860 shows 800 un-redeemed S. I. M. points. Call 08719899229 Identifier Code: 40411 Expires 06/11/04,,,
spam,Congrats! Nokia 3650 video camera phone is your Call 09066382422 Calls cost 150ppm Ave call 3mins vary from mobiles 16+ Close 300603 post BCM4284 Ldn WC1N3XX,,,
spam,URGENT! We are trying to contact U. Todays draw shows that you have won a Ż800 prize GUARANTEED. Call 09050003091 from land line. Claim C52. Valid 12hrs only,,,
spam,Todays Voda numbers ending 1225 are selected to receive a Ż50award. If you have a match please call 08712300220 quoting claim code 3100 standard rates app,,,
ham,How is your schedule next week? I am out of town this weekend.,,,
ham,Nope... C ³ then...,,,
spam,07732584351 - Rodger Burns - MSG = We tried to call you re your reply to our sms for a free nokia mobile + free camcorder. Please call now 08000930705 for delivery tomorrow,,,
ham,Sorry me going home first... Daddy come fetch ³ later...,,,
ham,"I can't keep going through this. It was never my intention to run you out, but if you choose to do that rather than keep the room clean so *I* don't have to say no to visitors, then maybe that's the best choice. Yes, I wanted you to be embarassed, so maybe you'd feel for once how I feel when i have a friend who wants to drop buy and i have to say no, as happened this morning. I've tried everything. I don't know what else to do.",,,
ham,There the size of elephant tablets & u shove um up ur ass!!,,,
spam,"Welcome to Select, an O2 service with added benefits. You can now call our specially trained advisors FREE from your mobile by dialling 402.",,,
ham,"Do you know why god created gap between your fingers..? So that, One who is made for you comes &amp; fills those gaps by holding your hand with LOVE..!",,,
spam,"Your account has been credited with 500 FREE Text Messages. To activate, just txt the word: CREDIT to No: 80488 T&Cs www.80488.biz",,,
spam,Jamster! To get your free wallpaper text HEART to 88888 now! T&C apply. 16 only. Need Help? Call 08701213186.,,,
ham,Ok... Let u noe when i leave my house.,,,
ham,Happy New Year Princess!,,,
ham,"Wen ur lovable bcums angry wid u, dnt take it seriously.. Coz being angry is d most childish n true way of showing deep affection, care n luv!.. kettoda manda... Have nice day da.",,,
ham,Happy New Year Princess!,,,
ham,"Wen ur lovable bcums angry wid u, dnt take it seriously.. Coz being angry is d most childish n true way of showing deep affection, care n luv!.. kettoda manda... Have nice day da.",,,
spam,"Hi babe its Chloe, how r u? I was smashed on saturday night, it was great! How was your weekend? U been missing me? SP visionsms.com Text stop to stop 150p/text",,,
spam,"Free Msg: get Gnarls Barkleys ""Crazy"" ringtone TOTALLY FREE just reply GO to this message right now!",,,
spam,"Final Chance! Claim ur Ż150 worth of discount vouchers today! Text YES to 85023 now! SavaMob, member offers mobile! T Cs SavaMob POBOX84, M263UZ. Ż3.00 Subs 16",,,
spam,You have 1 new message. Call 0207-083-6089,,,
ham,Shopping? Eh ger i toking abt syd leh...Haha,,,
ham,Will do. Was exhausted on train this morning. Too much wine and pie. You sleep well too,,,
ham,I absolutely LOVE South Park! I only recently started watching the office.,,,
ham,Then anything special?,,,
spam,todays vodafone numbers ending with 0089(my last four digits) are selected to received a Ż350 award. If your number matches please call 09063442151 to claim your Ż350 award,,,
spam,"TheMob>Hit the link to get a premium Pink Panther game, the new no. 1 from Sugababes, a crazy Zebra animation or a badass Hoody wallpaper-all 4 FREE!",,,
ham,You are right. Meanwhile how's project twins comin up,,,
spam,"You have been selected to stay in 1 of 250 top British hotels - FOR NOTHING! Holiday Worth Ż350! To Claim, Call London 02072069400. Bx 526, SW73SS",,,
spam,"HOT LIVE FANTASIES call now 08707500020 Just 20p per min NTT Ltd, PO Box 1327 Croydon CR9 5WB 0870 is a national rate call",,,
ham,You have got tallent but you are wasting.,,,
ham,Hi its Kate how is your evening? I hope i can see you tomorrow for a bit but i have to bloody babyjontet! Txt back if u can. :) xxx,,,
ham,"Sorry sir, i will call you tomorrow.  senthil.hsbc",,,
ham,"Could you not read me, my Love ? I answered you",,,
ham,Ball is moving a lot.will spin in last :)so very difficult to bat:),,,
spam,"This weeks SavaMob member offers are now accessible. Just call 08709501522 for details! SavaMob, POBOX 139, LA3 2WU. Only Ż1.50/week. SavaMob - offers mobile!",,,
spam,Talk sexy!! Make new friends or fall in love in the worlds most discreet text dating service. Just text VIP to 83110 and see who you could meet.,,,
ham,Okay but i thought you were the expert,,,
spam,"Will u meet ur dream partner soon? Is ur career off 2 a flyng start? 2 find out free, txt HORO followed by ur star sign, e. g. HORO ARIES",,,
ham,Can i get your opinion on something first?,,,
spam,Bloomberg -Message center +447797706009 Why wait? Apply for your future http://careers. bloomberg.com,,,
spam,"Wan2 win a Meet+Greet with Westlife 4 U or a m8? They are currently on what tour? 1)Unbreakable, 2)Untamed, 3)Unkempt. Text 1,2 or 3 to 83049. Cost 50p +std text",,,
spam,"Urgent Urgent! We have 800 FREE flights to Europe to give away, call B4 10th Sept & take a friend 4 FREE. Call now to claim on 09050000555. BA128NNFWFLY150ppm",,,
ham,Happy new years melody!,,,
spam,"Latest Nokia Mobile or iPOD MP3 Player +Ż400 proze GUARANTEED! Reply with: WIN to 83355 now! Norcorp Ltd.Ż1,50/Mtmsgrcvd18+",,,
ham,"Night has ended for another day, morning has come in a special way. May you smile like the sunny rays and leaves your worries at the blue blue bay. Gud mrng",,,
ham,Great! How is the office today?,,,
spam,Ur cash-balance is currently 500 pounds - to maximize ur cash-in now send CASH to 86688 only 150p/msg. CC: 08708800282 HG/Suite342/2Lands Row/W1J6HL,,,
ham,What time should I tell my friend to be around?,,,
ham,Up to ³... ▄ want to come then.,,,
ham,"Sorry, I'll call later",,,
spam,You have 1 new message. Please call 08718738034.,,,
ham,"Could you not read me, my Love ? I answered you",,,
spam,Natalie (20/F) is inviting you to be her friend. Reply YES-165 or NO-165 See her: www.SMS.ac/u/natalie2k9 STOP? Send STOP FRND to 62468,,,
spam,You have won a Nokia 7250i. This is what you get when you win our FREE auction. To take part send Nokia to 86021 now. HG/Suite342/2Lands Row/W1JHL 16+,,,
spam,Congratulations ur awarded 500 of CD vouchers or 125gift guaranteed & Free entry 2 100 wkly draw txt MUSIC to 87066,,,
ham,Is avatar supposed to have subtoitles,,,
spam,Email AlertFrom: Jeri StewartSize: 2KBSubject: Low-cost prescripiton drvgsTo listen to email call 123,,,
ham,Yes..gauti and sehwag out of odi series.,,,
ham,ME 2 BABE I FEEL THE SAME LETS JUST 4GET ABOUT IT+BOTH TRY +CHEER UP+NOT FIT SOO MUCHXXLOVE U LOCAXX,,,
ham,Yes..he is really great..bhaji told kallis best cricketer after sachin in world:).very tough to get out.,,,
spam,You can donate Ż2.50 to UNICEF's Asian Tsunami disaster support fund by texting DONATE to 864233. Ż2.50 will be added to your next bill,,,
ham,Hey anyway i have to :-),,,
ham,"You aren't coming home between class, right? I need to work out and shower!",,,
spam,"URGENT! Your mobile was awarded a Ż1,500 Bonus Caller Prize on 27/6/03. Our final attempt 2 contact U! Call 08714714011",,,
ham,Ok set let u noe e details later...,,,
ham,"Feb  &lt;#&gt;  is ""I LOVE U"" day. Send dis to all ur ""VALUED FRNDS"" evn me. If 3 comes back u'll gt married d person u luv! If u ignore dis u will lose ur luv 4 Evr",,,
ham,"Hey ! I want you ! I crave you ! I miss you ! I need you ! I love you, Ahmad Saeed al Hallaq ...",,,
ham,"Sorry,in meeting I'll call later",,,
spam,FREEMSG: Our records indicate you may be entitled to 3750 pounds for the Accident you had. To claim for free reply with YES to this msg. To opt out text STOP,,,
ham,Only 2% students solved this CAT question in 'xam... 5+3+2= &lt;#&gt;  9+2+4= &lt;#&gt;  8+6+3= &lt;#&gt;  then 7+2+5=????? Tell me the answer if u r brilliant...1thing.i got d answr.,,,
spam,"SMS. ac sun0819 posts HELLO:""You seem cool, wanted to say hi. HI!!!"" Stop? Send STOP to 62468",,,
ham,R u in this continent?,,,
spam,New TEXTBUDDY Chat 2 horny guys in ur area 4 just 25p Free 2 receive Search postcode or at gaytextbuddy.com. TXT ONE name to 89693,,,
ham,Yes :)it completely in out of form:)clark also utter waste.,,,
ham,"G says you never answer your texts, confirm/deny",,,
spam,"Auction round 4. The highest bid is now Ż54. Next maximum bid is Ż71. To bid, send BIDS e. g. 10 (to bid Ż10) to 83383. Good luck.",,,
ham,"Aight, sounds good. When do you want me to come down?",,,
spam,Refused a loan? Secured or Unsecured? Can't get credit? Call free now 0800 195 6669 or text back 'help' & we will!,,,
ham,No. I dont want to hear anything,,,
spam,Valentines Day Special! Win over Ż1000 in our quiz and take your partner on the trip of a lifetime! Send GO to 83600 now. 150p/msg rcvd. CustCare:08718720201.,,,
spam,URGENT! Your Mobile number has been awarded with a Ż2000 prize GUARANTEED. Call 09061790126 from land line. Claim 3030. Valid 12hrs only 150ppm,,,
ham,Your dad is back in ph?,,,
ham,Yo dude guess who just got arrested the other day,,,
ham,"Yes obviously, but you are the eggs-pert and the potato headģ Speak soon!",,,
ham,This girl does not stay in bed. This girl doesn't need recovery time. Id rather pass out while having fun then be cooped up in bed,,,
ham,"came to look at the flat, seems ok, in his 50s? * Is away alot wiv work. Got woman coming at 6.30 too.",,,
ham,Pls send me the correct name da.,,,
spam,2p per min to call Germany 08448350055 from your BT line. Just 2p per min. Check PlanetTalkInstant.com for info & T's & C's. Text stop to opt out,,,
ham,Well keep in mind I've only got enough gas for one more round trip barring a sudden influx of cash,,,
ham,"I am real, baby! I want to bring out your inner tigress...",,,
ham,Webpage s not available!,,,
ham,So when do you wanna gym?,,,
spam,Kit Strip - you have been billed 150p. Netcollex Ltd. PO Box 1013 IG11 OJA,,,
spam,"HOT LIVE FANTASIES call now 08707509020 Just 20p per min NTT Ltd, PO Box 1327 Croydon CR9 5WB 0870 is a national rate call",,,
ham,"Will do, you gonna be at blake's all night? I might be able to get out of here a little early",,,
spam,Santa Calling! Would your little ones like a call from Santa Xmas eve? Call 09058094583 to book your time.,,,
ham,Yes there were many sweets,,,
ham,He's in lag. That's just the sad part but we keep in touch thanks to skype,,,
spam,Had your mobile 10 mths? Update to latest Orange camera/video phones for FREE. Save Żs with Free texts/weekend calls. Text YES for a callback orno to opt out,,,
ham,"The fact that you're cleaning shows you know why i'm upset. Your priority is constantly ""what i want to do,"" not ""what i need to do.""",,,
spam,"Bored of speed dating? Try SPEEDCHAT, txt SPEEDCHAT to 80155, if you don't like em txt SWAP and get a new chatter! Chat80155 POBox36504W45WQ 150p/msg rcd 16",,,
spam,We tried to call you re your reply to our sms for a video mobile 750 mins UNLIMITED TEXT + free camcorder Reply of call 08000930705 Now,,,
spam,We tried to call you re your reply to our sms for a video mobile 750 mins UNLIMITED TEXT + free camcorder Reply of call 08000930705 Now,,,
spam,"Thanks for your ringtone order, reference number X49.Your mobile will be charged 4.50. Should your tone not arrive please call customer services 09065989182",,,
ham,"Sorry, I'll call later",,,
ham,Lol ... I really need to remember to eat when I'm drinking but I do appreciate you keeping me company that night babe *smiles*,,,
spam,We tried to call you re your reply to our sms for a video mobile 750 mins UNLIMITED TEXT + free camcorder Reply of call 08000930705 Now,,,
ham,Hi..i got the money da:),,,
ham,Be sure to check your yahoo email. We sent photos yesterday,,,
ham,"Hurry up, I've been weed-deficient for like three days",,,
spam,We tried to call you re your reply to our sms for a video mobile 750 mins UNLIMITED TEXT + free camcorder Reply of call 08000930705 Now,,,
ham,Stop calling everyone saying I might have cancer. My throat hurts to talk. I can't be answering everyones calls. If I get one more call I'm not babysitting on Monday,,,
spam,Free Top ringtone -sub to weekly ringtone-get 1st week free-send SUBPOLY to 81618-?3 per week-stop sms-08718727870,,,
spam,WIN URGENT! Your mobile number has been awarded with a Ż2000 prize GUARANTEED call 09061790121 from land line. claim 3030 valid 12hrs only 150ppm,,,
spam,I'd like to tell you my deepest darkest fantasies. Call me 09094646631 just 60p/min. To stop texts call 08712460324 (nat rate),,,
ham,U wan 2 haf lunch i'm in da canteen now.,,,
ham,I dont want to hear anything,,,
spam,"For ur chance to win a Ż250 wkly shopping spree TXT: SHOP to 80878. T's&C's www.txt-2-shop.com custcare 08715705022, 1x150p/wk",,,
spam,Ur HMV Quiz cash-balance is currently Ż500 - to maximize ur cash-in now send HMV1 to 86688 only 150p/msg,,,
spam,Ringtone Club: Get the UK singles chart on your mobile each week and choose any top quality ringtone! This message is free of charge.,,,
spam,Dear 0776xxxxxxx U've been invited to XCHAT. This is our final attempt to contact u! Txt CHAT to 86688 150p/MsgrcvdHG/Suite342/2Lands/Row/W1J6HL LDN 18yrs,,,
ham,▄ still got lessons?  ▄ in sch?,,,
spam,WOW! The Boys R Back. TAKE THAT 2007 UK Tour. Win VIP Tickets & pre-book with VIP Club. Txt CLUB to 81303. Trackmarque Ltd info@vipclub4u.,,,
ham,I love u 2 my little pocy bell I am sorry but I love u,,,
spam,WINNER!! As a valued network customer you have been selected to receivea Ż900 prize reward! To claim call 09061701461. Claim code KL341. Valid 12 hours only.,,,
ham,"Hey chief, can you give me a bell when you get this. Need to talk to you about this royal visit on the 1st june.",,,
spam,Well done ENGLAND! Get the official poly ringtone or colour flag on yer mobile! text TONE or FLAG to 84199 NOW! Opt-out txt ENG STOP. Box39822 W111WX Ż1.50,,,
ham,By monday next week. Give me the full gist,,,
ham,"* Was really good to see you the other day dudette, been missing you!",,,
ham,I wud never mind if u dont miss me or if u dont need me.. But u wil really hurt me wen u need me &amp; u dont tell me......... Take care:-),,,
ham,I'm on da bus going home...,,,
ham,"Derp. Which is worse, a dude who always wants to party or a dude who files a complaint about the three drug abusers he lives with",,,
ham,Dont worry. I guess he's busy.,,,
ham,"Awesome, think we can get an 8th at usf some time tonight?",,,
ham,I dont. Can you send it to me. Plus how's mode.,,,
ham,"No, I was trying it all weekend ;V",,,
spam,Sorry I missed your call let's talk when you have the time. I'm on 07090201529,,,
ham,Any way where are you and what doing.,,,
ham,"Just wondering, the others just took off",,,
ham,The whole car appreciated the last two! Dad and are having a map reading semi argument but apart from that things are going ok. P.,,,
ham,Nope... Think i will go for it on monday... Sorry i replied so late,,,
ham,Jokin only lar... :-) depends on which phone my father can get lor...,,,
spam,FREE entry into our Ż250 weekly comp just send the word ENTER to 84128 NOW. 18 T&C www.textcomp.com cust care 08712405020.,,,
ham,So how many days since then?,,,
ham,Package all your programs well,,,
spam,"Hello from Orange. For 1 month's free access to games, news and sport, plus 10 free texts and 20 photo messages, reply YES. Terms apply: www.orange.co.uk/ow",,,
ham,Are you this much buzy,,,
ham,Oh ok..,,,
spam,No 1 POLYPHONIC tone 4 ur mob every week! Just txt PT2 to 87575. 1st Tone FREE ! so get txtin now and tell ur friends. 150p/tone. 16 reply HL 4info,,,
ham,I dont know oh. Hopefully this month.,,,
ham,I'm so in love with you. I'm excited each day i spend with you. You make me so happy.,,,
spam,"Dear Matthew please call 09063440451 from a landline, your complimentary 4*Lux Tenerife holiday or Ż1000 CASH await collection. ppm150 SAE T&Cs Box334 SK38XH.",,,
ham,I dont understand your message.,,,
spam,"Orange customer, you may now claim your FREE CAMERA PHONE upgrade for your loyalty. Call now on 0207 153 9996. Offer ends 14thMarch. T&C's apply. Opt-out availa",,,
ham,She's fine. Good to hear from you. How are you my dear? Happy new year oh.,,,
spam,"XXXMobileMovieClub: To use your credit, click the WAP link in the next txt message or click here>> http://wap. xxxmobilemovieclub.com?n=QJKGIGHJJGCBL",,,
spam,"Thanks for your ringtone order, reference number X49.Your mobile will be charged 4.50. Should your tone not arrive please call customer services 09065989182",,,
ham,Yeah imma come over cause jay wants to do some drugs,,,
spam,"500 New Mobiles from 2004, MUST GO! Txt: NOKIA to No: 89545 & collect yours today!From ONLY Ż1 www.4-tc.biz 2optout 087187262701.50gbp/mtmsg18",,,
ham,"Good good, billy mates all gone. Just been jogging, again! Did enjoy concert?",,,
spam,YES! The only place in town to meet exciting adult singles is now in the UK. Txt CHAT to 86688 now! 150p/Msg.,,,
spam,"URGENT! Last weekend's draw shows that you have won Ż1000 cash or a Spanish holiday! CALL NOW 09050000332 to claim. T&C: RSTM, SW7 3SS. 150ppm",,,
spam,<Forwarded from 21870000>Hi - this is your Mailbox Messaging SMS alert. You have 4 messages. You have 21 matches. Please call back on 09056242159 to retrieve your messages and matches,,,
ham,Hey i will be really pretty late... You want to go for the lesson first? I will join you. I'm only reaching tp mrt,,,
ham,But my family not responding for anything. Now am in room not went to home for diwali but no one called me and why not coming. It makes me feel like died.,,,
spam,Todays Vodafone numbers ending with 4882 are selected to a receive a Ż350 award. If your number matches call 09064019014 to receive your Ż350 award.,,,
spam,"Thanks for your ringtone order, reference number X49.Your mobile will be charged 4.50. Should your tone not arrive please call customer services 09065989182",,,
spam,"You are being contacted by our dating service by someone you know! To find out who it is, call from a land line 09050000928. PoBox45W2TG150P",,,
spam,Free video camera phones with Half Price line rental for 12 mths and 500 cross ntwk mins 100 txts. Call MobileUpd8 08001950382 or Call2OptOut/674,,,
ham,Then wat r u doing now? Busy wif work?,,,
ham,When u love someone Dont make them to love u as much as u do. But Love them so much that they dont want to be loved by anyone except you... Gud nit.,,,
ham,WHO ARE YOU SEEING?,,,
ham,Goodo! Yes we must speak friday - egg-potato ratio for tortilla needed!,,,
ham,Where are you ? What do you do ? How can you stand to be away from me ? Doesn't your heart ache without me ? Don't you wonder of me ? Don't you crave me ?,,,
ham,"Sorry, I'll call later",,,
spam,Please call our customer service representative on FREEPHONE 0808 145 4742 between 9am-11pm as you have WON a guaranteed Ż1000 cash or Ż5000 prize!,,,
spam,SMS AUCTION - A BRAND NEW Nokia 7250 is up 4 auction today! Auction is FREE 2 join & take part! Txt NOKIA to 86021 now! HG/Suite342/2Lands Row/W1J6HL,,,
ham,Ok. I asked for money how far,,,
spam,Buy Space Invaders 4 a chance 2 win orig Arcade Game console. Press 0 for Games Arcade (std WAP charge) See o2.co.uk/games 4 Terms + settings. No purchase,,,
ham,Hi Harish's rent has been transfred to ur Acnt.,,,
spam,HMV BONUS SPECIAL 500 pounds of genuine HMV vouchers to be won. Just answer 4 easy questions. Play Now! Send HMV to 86688 More info:www.100percent-real.com,,,
ham,"New Theory: Argument wins d SITUATION, but loses the PERSON. So dont argue with ur friends just.. . . . kick them &amp; say, I'm always correct.!",,,
ham,MAKE SURE ALEX KNOWS HIS BIRTHDAY IS OVER IN FIFTEEN MINUTES AS FAR AS YOU'RE CONCERNED,,,
ham,I'm very happy for you babe ! Woo hoo party on dude!,,,
ham,Aiya we discuss later lar... Pick ³ up at 4 is it?,,,
ham,Wylie update: my weed dealer carlos went to freedom and had a class with lunsford,,,
ham,All will come alive.better correct any good looking figure there itself..,,,
spam,"YOU VE WON! Your 4* Costa Del Sol Holiday or Ż5000 await collection. Call 09050090044 Now toClaim. SAE, TC s, POBox334, Stockport, SK38xh, CostŻ1.50/pm, Max10mins",,,
ham,It means u could not keep ur words.,,,
spam,U have a secret admirer who is looking 2 make contact with U-find out who they R*reveal who thinks UR so special-call on 09058094599,,,
ham,Many more happy returns of the day. I wish you happy birthday.,,,
