Category,Message,,,
spam,Reminder: You have not downloaded the content you paid for. Visit the link to collect your content.,,,
ham,Thank you so much. Hope you are good. We are counting down. Enjoy!,,,
ham,I will come. I want to go to the hospital tomorrow. After that I will come. This is what I got from herŚwhat to do? She didnÆt give a time.,,,
ham,I sent the printouts.,,,
spam,Thousands of people in your area are ready to chat. Text CUTE to 69911.,,,
ham,Now press conference.,,,
ham,Give one missed call from that number please.,,,
ham,Good morning. At the repair shopŚthe only reason I am up at this hour.,,,
spam,URGENT! This is the second attempt to contact you. You have won Ż1250. Call 09071512433.,,,
spam,Do you want a new video handset? Unlimited texts? Reply or call 08000930705.,,,
spam,"Sunshine Holidays: To claim, send a stamped envelope to Drinks on Us UK.",,,
spam,You have an important customer service announcement. Call FREEPHONE 0800 542 0825.,,,
spam,You have an important customer service announcement from Premier. Call FREEPHONE 0800 542 0578.,,,
ham,"Sorry, itÆs my friendÆs phone and I didnÆt type that message Ś Kate.",,,
ham,Nice one!,,,
ham,"Hi, what do you think about the match?",,,
ham,I will see in half an hour.,,,
ham,Every Mondayģ next week it will be completed.,,,
ham,A person who gets used and doesnÆt realize it.,,,
ham,I sent you the money.,,,
ham,There generally isnÆt one. ItÆs an uncountable noun.,,,
spam,You are a winner. You have been selected to receive Ż1000 cash or a Ż2000 award. Call 08714712377.,,,
spam,We tried contacting you regarding your reply for our offer. Call 08002988890.,,,
ham,Just glad to be talking to you.,,,
spam,You are awarded a city break and could win a Ż200 shopping spree. Text STORE to 88039.,,,
ham,Detroit. The home of snow. Enjoy it.,,,
ham,Check mail. I have emailed Varma and copied you. Take care.,,,
ham,The affidavit says the address and courtroom; IÆll double-check and text again tomorrow.,,,
spam,Free message: New camera phoneŚwant to see a demo picture? Text CHAT to 82242.,,,
ham,Hey what are you doing? Why no reply?,,,
ham,"Okay, see you then.",,,
ham,"I couldnÆt say no; he is a very sick man and I feel sad, so I will go. I will be back late.",,,
ham,Back in Birmingham! Thanks for everything. See you soon.,,,
spam,URGENT! Your mobile won a Ż2000 bonus caller prize. Call 09066362231 ASAP.,,,
spam,LIVE FANTASY line call 08707509020.,,,
spam,Please call our customer service representative on 0808 145 4742 as you have WON Ż1000 cash or a Ż5000 prize.,,,
ham,"Hi, where are you? At home or in Calicut?",,,
ham,"Yes, leaving now, be back soon.",,,
spam,Fantasy Football is back. Register now on Sky Gamestar.,,,
ham,"Hey, are you still online? IÆve finished formatting.",,,
ham,"Hi, this is Yijue. Can I meet you at 11 tomorrow?",,,
ham,"Good afternoon, hope your day is going well. Hope you got leads on a job.",,,
ham,Need to be in town by eight to walk from the car park.,,,
spam,Text and meet someone today. Reply with your name and age.,,,
ham,First answer my question.,,,
spam,Spook up your phone with a Halloween logo and tone. Text CARD SPOOK to 8007.,,,
spam,You are a winner. You have been selected to receive Ż1000 cash or a 4? holiday. Call 08712778107.,,,
spam,#ERROR!,,,
spam,I am available locally. Text a reply to get a response. Text STOP to end.,,,
spam,"Mila, age 23, new in UK. For chat text MTALK to 69866 (18+).",,,
ham,"Okay, no problem.",,,
ham,Yesģ but they said it is IT.,,,
ham,"Okay, IÆm ready.",,,
spam,Free camera phones with line rental from Ż4.49/month. Call 08001950382.,,,
ham,Hope you are having a good week. Just checking in.,,,
spam,I donÆt know you and you donÆt know me. Send CHAT to 86688.,,,
ham,Send your birthdate and I will tell you your life partnerÆs name calculation.,,,
ham,"Hi, do you want to join me with STS later? Meeting at 5.",,,
ham,What do you need? You already have someone to give you that.,,,
spam,From next month get up to 50% more calls. Call 9061100010.,,,
ham,"Please send me a mail about relatives coming to deliver hereŚcosts, risks, benefits, everything.",,,
ham,Dad says hurry up.,,,
spam,Orange brings you ringtones every week! To stop reply STOP.,,,
ham,"Hi, it's in DurbanŚare you still on this number?",,,
ham,Tap & Spile at seven. ItÆs the pub on Gas Street.,,,
spam,You will not receive more messages from the chat service.,,,
ham,I saw him too but I thought he didnÆt see me. I found a group.,,,
ham,IÆm going to be bored all dayŚcable and internet outage.,,,
spam,Check out video selections at the site.,,,
ham,Thank you!,,,
spam,TheMob: New downloads available.,,,
spam,YouÆve won tickets to EURO2004 or Ż800 cash. Call 09058099801.,,,
ham,What are you up to then?,,,
ham,Let there be snow. This weather brings people together.,,,
ham,She left it vague; said sheÆll inform accounting about the rent delay.,,,
ham,IÆm eating now but going back to work soon.,,,
ham,Got it! It looks great.,,,
spam,Latest news: Police station toilet stolenŚcops have nothing to go on.,,,
ham,I squeezed money out of my dad.,,,
spam,I donÆt know you and you donÆt know me. Send CHAT to 86688.,,,
spam,PRIVATE! Your 2003 statement shows 800 unused points. Call 08715203694.,,,
spam,You are a winner. You have been selected to receive Ż1000 cash or a 4? holiday.,,,
spam,Had your mobile 11 months? Update for FREE. Call 08000839402.,,,
ham,"If I start sending phones to Nigeria, will you find a buyer? Tell dad not to buy from just anyone.",,,
ham,Her lesson is early. IÆm still sleeping. Confirm with me later.,,,
ham,For real. She told my dad I have cancer.,,,
spam,You have 1 new message. Call 08715205273.,,,
spam,WELL DONE! Your holiday or Ż5000 awaits. Call 09050090044.,,,
ham,I am in the bus on the way to Calicut.,,,
ham,HowÆs Scotland? Hope youÆre not overdoing it.,,,
ham,"Not yetģ okay, what about that guy? Did he stop messaging you?",,,
ham,"I know where it is, IÆll be there around 5.",,,
ham,Okay no problem. Take your time.,,,
spam,Get your first ringtone free. Reply TONE.,,,
spam,Are you unique enough? Find out at the site.,,,
ham,"Like earlier, same question.",,,
ham,You will be in the place of that man.,,,
ham,"And very importantly, everything we discuss is between you and me only.",,,
ham,Give me a few minutes.,,,
ham,Why donÆt you have new pictures on Facebook?,,,
spam,URGENT! Your mobile number has been awarded a Ż2000 prize. Call 09061790125.,,,
spam,Text me if you want content. To cancel text STOP.,,,
ham,It's getting me down just waiting around.,,,
spam,"Loan available Ż500¢Ż75,000. Call 0800 1956669.",,,
ham,"Home now, so we can chat.",,,
spam,You have won a Nokia 6230 and a digital camera. Send NOKIA to 83383.,,,
ham,"Nothing, just getting messages from this name with different numbers.",,,
ham,"Or ask them all if next Saturday works. If yes, then IÆm okay.",,,
ham,"Sorry, IÆll call later.",,,
spam,Call Germany for 1p per minute!,,,
spam,"Thank you, winner notified by SMS. Reply STOP to opt out.",,,
spam,Enjoy the club with your credits for videos and logos.,,,
spam,Free Nokia or Motorola with half-price line rental. Call 08001950382.,,,
ham,Just reached home.,,,
spam,Not heard from you for a while. Call me.,,,
ham,Thanks a lot.,,,
ham,Are you coming back for dinner?,,,
ham,They are giving a second chance to Rahul D.,,,
ham,True care will never go unrecognized. People understand its value later.,,,
ham,Please confirm the time to collect the cheque.,,,
ham,Okay.,,,
ham,Same with me. Thanks for the clarification.,,,
ham,I will vote where my heart guides me.,,,
ham,"I hoped I wouldnÆt have to ask, but my rent is due and I donÆt have enough. I need a loan. The balance is this amount. Could you help till mid-March?",,,
spam,HMV BONUS SPECIAL: Ż500 in vouchers to be won. Send HMV to 86688.,,,
spam,"Dear Dave, this is your final notice to collect your 4? Tenerife Holiday or Ż5000 cash. Call 09061743806.",,,
spam,Lord of the Rings: Return of the King in store now! Reply LOTR by 2 June.,,,
spam,"Double mins, double texts, and half-price line rental. Call 08000839402.",,,
ham,IÆm homeģ if youÆre awake.,,,
ham,"Alright, IÆm in a friendÆs room. Text me when youÆre on the way.",,,
spam,Text PASS to 69669 to collect your polyphonic ringtones. Normal gprs charges apply only. Enjoy your tones,,,
ham,Oh...i asked for fun. Haha...take care. ³,,,
ham,Hey morning what you come to ask:-) pa...,,,
spam,Hi I'm sue. I am 20 years old and work as a lapdancer. I love sex. Text me live - I'm i my bedroom now. text SUE to 89555. By TextOperator G2 1DA 150ppmsg 18+,,,
ham,"Er yeah, i will b there at 15:26, sorry! Just tell me which pub/cafe to sit in and come wen u can",,,
ham,Oh yeah clearly it's my fault,,,
ham,"I'll call you tomorrow at ninish, with my address that icky American freek wont stop callin me 2 bad Jen k eh?",,,
ham,"Right on brah, see you later",,,
spam,"This is the 2nd time we have tried 2 contact u. U have won the 750 Pound prize. 2 claim is easy, call 08712101358 NOW! Only 10p per min. BT-national-rate",,,
ham,K...k...when will you give treat?,,,
ham,Tessy..pls do me a favor. Pls convey my birthday wishes to Nimya..pls dnt forget it. Today is her birthday Shijas,,,
spam,URGENT! We are trying to contact U. Todays draw shows that you have won a Ż2000 prize GUARANTEED. Call 09058094507 from land line. Claim 3030. Valid 12hrs only,,,
ham,Kaiez... Enjoy ur tuition... Gee... Thk e second option sounds beta... I'll go yan jiu den msg u...,,,
ham,"We are hoping to get away by 7, from Langport. You still up for town tonight?",,,
spam,"URGENT! Your mobile number *************** WON a Ż2000 Bonus Caller prize on 10/06/03! This is the 2nd attempt to reach you! Call 09066368753 ASAP! Box 97N7QP, 150ppm",,,
spam,Dear Voucher holder Have your next meal on us. Use the following link on your pc 2 enjoy a 2 4 1 dining experiencehttp://www.vouch4me.com/etlp/dining.asp,,,
ham,I'm ok wif it cos i like 2 try new things. But i scared u dun like mah. Cos u said not too loud.,,,
ham,I not busy just don't want to go so early.. Hee..,,,
ham,Usually the body takes care of it buy making sure it doesnt progress. Can we pls continue this talk on saturday.,,,
ham,Ofcourse I also upload some songs,,,
ham,"Imagine you finally get to sink into that bath after I have put you through your paces, maybe even having you eat me for a while before I left ... But also imagine the feel of that cage on your cock surrounded by the bath water, reminding you always who owns you ... Enjoy, my cuck",,,
spam,"UpgrdCentre Orange customer, you may now claim your FREE CAMERA PHONE upgrade for your loyalty. Call now on 0207 153 9153. Offer ends 26th July. T&C's apply. Opt-out available",,,
spam,network operator. The service is free. For T & C's visit 80488.biz,,,
ham,Not..tel software name..,,,
spam,"Fantasy Football is back on your TV. Go to Sky Gamestar on Sky Active and play Ż250k Dream Team. Scoring starts on Saturday, so register now!SKY OPT OUT to 88088",,,
spam,"FREE GAME. Get Rayman Golf 4 FREE from the O2 Games Arcade. 1st get UR games settings. Reply POST, then save & activ8. Press 0 key for Arcade. Termsapply",,,
ham,"What i mean was i left too early to check, cos i'm working a 9-6.",,,
ham,I'm sick !! ,,,
ham,Is toshiba portege m100 gd?,,,
ham,"I'm tired of arguing with you about this week after week. Do what you want and from now on, i'll do the same.",,,
spam,I don't know u and u don't know me. Send CHAT to 86688 now and let's find each other! Only 150p/Msg rcvd. HG/Suite342/2Lands/Row/W1J6HL LDN. 18 years or over.,,,
ham,Exactly. Anyways how far. Is jide her to study or just visiting,,,
ham,So how are you really. What are you up to. How's the masters. And so on.,,,
spam,"SMS SERVICES. for your inclusive text credits, pls goto www.comuk.net login= 3qxj9 unsubscribe with STOP, no extra charge. help 08702840625.COMUK. 220-CM2 9AE",,,
spam,Hey I am really horny want to chat or see me naked text hot to 69698 text charged at 150pm to unsubscribe text stop 69698,,,
ham,Kind of. Took it to garage. Centre part of exhaust needs replacing. Part ordered n taking it to be fixed tomo morning.,,,
spam,Please call our customer service representative on 0800 169 6031 between 10am-9pm as you have WON a guaranteed Ż1000 cash or Ż5000 prize!,,,
ham,Dunno y u ask me.,,,
spam,"You have been specially selected to receive a ""3000 award! Call 08712402050 BEFORE the lines close. Cost 10ppm. 16+. T&Cs apply. AG Promo",,,
ham,Yes. Nigh you cant aha.,,,
spam,Dear U've been invited to XCHAT. This is our final attempt to contact u! Txt CHAT to 86688 150p/MsgrcvdHG/Suite342/2Lands/Row/W1J6HL LDN 18 yrs,,,
spam,Reply to win Ż100 weekly! Where will the 2006 FIFA World Cup be held? Send STOP to 87239 to end service,,,
spam,December only! Had your mobile 11mths+? You are entitled to update to the latest colour camera mobile for Free! Call The Mobile Update Co FREE on 08002986906,,,
ham,"I keep seeing weird shit and bein all ""woah"" then realising it's actually reasonable and I'm all ""oh""",,,
ham,This pen thing is beyond a joke. Wont a Biro do? Don't do a masters as can't do this ever again!,,,
ham,Yes its possible but dint try. Pls dont tell to any one k,,,
spam,"Rock yr chik. Get 100's of filthy films &XXX pics on yr phone now. rply FILTH to 69669. Saristar Ltd, E14 9YT 08701752560. 450p per 5 days. Stop2 cancel",,,
ham,Hi. Hope you had a good day. Have a better night.,,,
ham,I just reached home from college. Tired as hell!!!!,,,
ham,Er yep sure. Props?,,,
ham,The Xmas story is peace.. The Xmas msg is love.. The Xmas miracle is jesus.. Hav a blessed month ahead &amp; wish U Merry Xmas...,,,
ham,I dont have any of your file in my bag..i was in work when you called me.i 'll tell you if i find anything in my room.,,,
spam,RT-KIng Pro Video Club>> Need help? info@ringtoneking.co.uk or call 08701237397 You must be 16+ Club credits redeemable at www.ringtoneking.co.uk! Enjoy!,,,
spam,Claim your FREE holiday package! 3 nights stay for 2. Reply TRAVELI7R3PS to 0994428468. Limited seats.,,,
spam,"Congrats! 1 year special cinema pass for 2 is yours. call 09061209465 now! C Suprman V, Matrix3, StarWars3, etc all 4 FREE! bx420-ip4-5we. 150pm. Dont miss out!",,,
spam,"Congrats 2 mobile 3G Videophones R yours. call 09063458130 now! videochat wid ur mates, play java games, Dload polypH music, noline rentl. bx420. ip4. 5we. 150p",,,
ham,Pls give her prometazine syrup. 5mls then  &lt;#&gt; mins later feed.,,,
spam,Thanks for your subscription to Ringtone UK your mobile will be charged Ż5/month Please confirm by replying YES or NO. If you reply NO you will not be charged,,,
spam,"Congrats! 1 year special cinema pass for 2 is yours. call 09061209465 now! C Suprman V, Matrix3, StarWars3, etc all 4 FREE! bx420-ip4-5we. 150pm. Dont miss out!",,,
spam,"Dear Voucher Holder, 2 claim this weeks offer, at your PC go to http://www.e-tlp.co.uk/expressoffer Ts&Cs apply.2 stop texts txt STOP to 80062.",,,
spam,INTERFLORA - ?It's not too late to order Interflora flowers for christmas call 0800 505060 to place your order before Midnight tomorrow.,,,
ham,Oh shut it. Omg yesterday I had a dream that I had 2 kids both boys. I was so pissed. Not only about the kids but them being boys. I even told mark in my dream that he was changing diapers cause I'm not getting owed in the face.,,,
spam,"Dear Voucher Holder, To claim this weeks offer, at your PC please go to http://www.wtlp.co.uk/text. Ts&Cs apply.",,,
ham,5 nights...We not staying at port step liao,,,
ham,Hi Dear Call me its urgnt. I don't know whats your problem. You don't want to work or if you have any other problem at least tell me. Wating for your reply.,,,
spam,<Forwarded from 448712404000>Please CALL 08712404000 immediately as there is an urgent message waiting for you.,,,
spam,"Twinks, bears, scallies, skins and jocks are calling now. Don't miss the weekend's fun. Call 08712466669 at 10p/min. 2 stop texts call 08712460324(nat rate)",,,
spam,"Had your contract mobile 11 Mnths? Latest Motorola, Nokia etc. all FREE! Double Mins & Text on Orange tariffs. TEXT YES for callback, no to remove from records.",,,
ham,"Wen u miss someone, the person is definitely special for u..... But if the person is so special, why to miss them, just Keep-in-touch gdeve..",,,
ham,Our ride equally uneventful - not too many of those pesky cyclists around at that time of night ;).,,,
ham,The world's most happiest frnds never have the same characters... Dey just have the best understanding of their differences...,,,
spam,"YOU 07801543489 are guaranteed the latests Nokia Phone, a 40GB iPod MP3 player or a Ż500 prize! Txt word:COLLECT to No:83355! TC-LLC NY-USA 150p/Mt msgrcvd18+",,,
spam,Freemsg: 1-month unlimited free calls! Activate SmartCall Txt: CALL to No: 68866. Subscriptn3gbp/wk unlimited calls Help: 08448714184 Stop?txt stop landlineonly,,,
spam,You have WON a guaranteed Ż1000 cash or a Ż2000 prize.To claim yr prize call our customer service representative on,,,
ham,Yar lor... Keep raining non stop... Or you wanna go elsewhere?,,,
ham,"I jus hope its true that  missin me cos i'm really missin him! You haven't done anything to feel guilty about, yet.",,,
spam,"Your free ringtone is waiting to be collected. Simply text the password ""MIX"" to 85069 to verify. Get Usher and Britney. FML, PO Box 5249, MK17 92H. 450Ppw 16",,,
spam,You have won a guaranteed Ż200 award or even Ż1000 cashto claim UR award call free on 08000407165 (18+) 2 stop getstop on 88222 PHP. RG21 4JX,,,
ham,I have 2 docs appointments next week.:/ I'm tired of them shoving stuff up me. Ugh why couldn't I have had a normal body?,,,
ham,"Nah man, my car is meant to be crammed full of people",,,
ham,"Aight yo, dats straight dogg",,,
spam,"Eerie Nokia tones 4u, rply TONE TITLE to 8007 eg TONE DRACULA to 8007 Titles: GHOST, ADDAMSFA, MUNSTERS, EXORCIST, TWILIGHT www.getzed.co.uk POBox36504W45WQ 150p",,,
spam,Please call Amanda with regard to renewing or upgrading your current T-Mobile handset free of charge. Offer ends today. Tel 0845 021 3680 subject to T's and C's,,,
spam,URGENT! We are trying to contact U. Todays draw shows that you have won a Ż800 prize GUARANTEED. Call 09050001808 from land line. Claim M95. Valid12hrs only,,,
ham,I re-met alex nichols from middle school and it turns out he's dealing!,,,
ham,All e\the best for your driving tmr :-),,,
ham,So li hai... Me bored now da lecturer repeating last weeks stuff waste time...,,,
spam,"You have won ?1,000 cash or a ?2,000 prize! To claim, call09050000327",,,
ham,"Painful words- ""I thought being Happy was the most toughest thing on Earth... But, the toughest is acting Happy with all unspoken pain inside..""",,,
ham,I emailed yifeng for my part oredi.. Can ³ get it from him..,,,
ham,Lol that's different. I don't go trying to find every real life photo you ever took.,,,
spam,* FREE* POLYPHONIC RINGTONE Text SUPER to 87131 to get your FREE POLY TONE of the week now! 16 SN PoBox202 NR31 7ZS subscription 450pw,,,
ham,Nvm... I'm going to wear my sport shoes anyway... I'm going to be late leh.,,,
ham,HI ITS KATE CAN U GIVE ME A RING ASAP XXX,,,
ham,Okies... I'll go join you at the resturaunt... ,,,
ham,You in your room? I need a few,,,
ham,Another month. I need chocolate weed and alcohol.,,,
ham,Ha! I wouldn't say that I just didn't read anything into way u seemed. I don't like 2 be judgemental....i save that for fridays in the pub!,,,
ham,Yes. that will be fine. Love you. Be safe.,,,
ham,"Well, i'm gonna finish my bath now. Have a good...fine night.",,,
spam,"Hi there, 2days your lucky trio! Uve been invited 2 XCHAT, the Uks adventure! Txt CHAT to 86688 now! 150p/MsgrcvdHG/Suite342/2Lands/Row/W1J6HL LDN 18yrs",,,
ham,"Sorry battery died, yeah I'm here",,,
ham,I cant pick the phone right now. Pls send a message,,,
ham,Ugh. Gotta drive back to sd from la. I'm tired and sore.,,,
spam,"URGENT! Your Mobile No was awarded a Ż2,000 Bonus Caller Prize on 1/08/03! This is our 2nd attempt to contact YOU! Call 0871-4719-523 BOX95QU BT National Rate",,,
spam,"This is the 2nd time we have tried 2 contact u. U have won the Ż750 Pound prize. 2 claim is easy, call 087187272008 NOW1! Only 10p per minute. BT-national-rate.",,,
ham,Dunno i juz askin cos i got a card got 20% off 4 a salon called hair sense so i tot it's da one ³ cut ur hair.,,,
spam,Had your mobile 11 months or more? U R entitled to Update to the latest colour mobiles with camera for Free! Call The Mobile Update Co FREE on 08002986030,,,
spam,74355 XMAS iscoming & ur awarded either Ż500 CD gift vouchers & free entry 2 r Ż100 weekly draw txt MUSIC to 87066 TnC,,,
ham,K still are you loving me.,,,
spam,FreeMsg: Fancy a flirt? Reply DATE now & join the UKs fastest growing mobile dating service. Msgs rcvd just 25p to optout txt stop to 83021. Reply DATE now!,,,
spam,"If you don't, your prize will go to another customer. T&C at www.t-c.biz 18+ 150p/min Polo Ltd Suite 373 London W1J 6HL Please call back if busy",,,
ham,CHEERS LOU! YEAH WAS A GOODNITE SHAME U NEVA CAME! C YA GAILxx,,,
spam,WINNER!! As a valued network customer you have been selected to receivea Ż900 prize reward! To claim call 09061701461. Claim code KL341. Valid 12 hours only.,,,
spam,You will recieve your tone within the next 24hrs. For Terms and conditions please see Channel U Teletext Pg 750,,,
ham,Thanks. Fills me with complete calm and reassurance!,,,
spam,Want a new Video Phone? 750 anytime any network mins? Half price line rental free text for 3 months? Reply or call 08000930705 for free delivery,,,
ham,I went to project centre,,,
spam,"FREE RING TONE just text ""POLYS"" to 87131. Then every week get a new tone. 0870737910216yrs only Ż1.50/wk.",,,
ham,I know that my friend already told that.,,,
ham,"Night has ended for another day, morning has come in a special way. May you smile like the sunny rays and leaves your worries at the blue blue bay.",,,
spam,Ur cash-balance is currently 500 pounds - to maximize ur cash-in now send GO to 86688 only 150p/msg. CC: 08718720201 PO BOX 114/14 TCR/W1,,,
spam,Hi its LUCY Hubby at meetins all day Fri & I will B alone at hotel U fancy cumin over? Pls leave msg 2day 09099726395 Lucy x CallsŻ1/minMobsmoreLKPOBOX177HP51FL,,,
ham,"HI HUN! IM NOT COMIN 2NITE-TELL EVERY1 IM SORRY 4 ME, HOPE U AVA GOODTIME!OLI RANG MELNITE IFINK IT MITE B SORTED,BUT IL EXPLAIN EVERYTHIN ON MON.L8RS.x",,,
ham,Meeting u is my work. . . Tel me when shall i do my work tomorrow,,,
spam,"3 FREE TAROT TEXTS! Find out about your love life now! TRY 3 FOR FREE! Text CHANCE to 85555 16 only! After 3 Free, Msgs Ż1.50 each",,,
ham,U sure u can't take any sick time?,,,
ham,"Gud gud..k, chikku tke care.. sleep well gud nyt",,,
spam,"5 Free Top Polyphonic Tones call 087018728737, National Rate. Get a toppoly tune sent every week, just text SUBPOLY to 81618, Ż3 per pole. UnSub 08718727870.",,,
spam,Dear Subscriber ur draw 4 Ż100 gift voucher will b entered on receipt of a correct ans. When was Elvis Presleys Birthday? TXT answer to 80062,,,
ham,"Ah, well that confuses things, doesnt it? I thought was friends with now. Maybe i did the wrong thing but i already sort of invited -tho he may not come cos of money.",,,
ham,Okie...,,,
ham,I.ll update her with the project. In class,,,
ham,Den wat will e schedule b lk on sun?,,,
ham,"We're all getting worried over here, derek and taylor have already assumed the worst",,,
ham,Ok thanx... Take care then...,,,
ham,Baaaaabe! I misss youuuuu ! Where are you ? I have to go and teach my class at 5 ...,,,
ham,THIS IS A LONG weekend!! Yaayyy,,,
ham,my mom is very sick.im visiting her in the hospitalģ,,,
ham,He's really into skateboarding now despite the fact that he gets thrown off of it and winds up with bandages and shit all over his arms every five minutes,,,
ham,I tot it's my group mate... Lucky i havent reply... Wat time do ³ need to leave...,,,
spam,"Double mins and txts 4 6months FREE Bluetooth on Orange. Available on Sony, Nokia Motorola phones. Call MobileUpd8 on 08000839402 or call2optout/N9DX",,,
ham,Thats cool. i am a gentleman and will treat you with dignity and respect.,,,
ham,"So you think i should actually talk to him? Not call his boss in the morning? I went to this place last year and he told me where i could go and get my car fixed cheaper. He kept telling me today how much he hoped i would come back in, how he always regretted not getting my number, etc.",,,
ham,Dear where you will be when i reach there,,,
ham,Joy's father is John. Then John is the NAME of Joy's father. Mandan,,,
spam,Someone has contacted our dating service and entered your phone because they fancy you! To find out who it is call from a landline 09111032124 . PoBox12n146tf150p,,,
spam,"500 New Mobiles from 2004, MUST GO! Txt: NOKIA to No: 89545 & collect yours today!From ONLY Ż1 www.4-tc.biz 2optout 087187262701.50gbp/mtmsg18 TXTAUCTION",,,
ham,Haha mayb u're rite... U know me well. Da feeling of being liked by someone is gd lor. U faster go find one then all gals in our group attached liao.,,,
spam,We tried to contact you re our offer of New Video Phone 750 anytime any network mins HALF PRICE Rental camcorder call 08000930705 or reply for delivery Wed,,,
ham,Just go google n search for qet...,,,
ham,We are outside already.,,,
ham,K. I will sent it again,,,
ham,"Hmmm... Guess we can go 4 kb n power yoga... Haha, dunno we can tahan power yoga anot... Thk got lo oso, forgot liao...",,,
ham,i see. When we finish we have loads of loans to pay,,,
spam,"Thanks for your ringtone order, ref number R836. Your mobile will be charged Ż4.50. Should your tone not arrive please call customer services on 09065069154",,,
ham,I have had two more letters from . I will copy them for you cos one has a message for you. Speak soon,,,
ham,Bring it if you got it,,,
