Category,Message,,,
ham,"Watching cartoons, listening to music, and in the evening I went to the temple and church. What about you?",,,
ham,Did you check? I received his detailed message now.,,,
ham,My friend Tyler asked if you could help him with something.,,,
spam,"You have won a Nokia 7250i in our free auction. To participate, text NOKIA to 86021 now. Terms apply.",,,
spam,"As a registered subscriber, your entry for a Ż100 gift voucher will be submitted after answering the question: When are the next Olympics? Text your answer to 80062.",,,
ham,No message and no response. What happened?,,,
ham,"They were upset at first, but eventually they relaxed.",,,
spam,Are you interested in connecting? Visit the service website for details. (Content sanitized),,,
ham,Okay.,,,
ham,IÆm in Solihull; do you need anything?,,,
spam,"This December only: if youÆve had your mobile for 11 months or more, you can upgrade to the latest colour camera phone for free. Call The Mobile Update Company at 08002986906.",,,
spam,"Tone Club: Your subscription has expired. To renew, reply MONOC for mono tones or POLYC for poly tones. Weekly charges apply. Reply STOP to unsubscribe.",,,
spam,Sunshine Quiz: Win a Sony DVD recorder by naming the capital of Australia. Text MQUIZ to 82277.,,,
spam,Congratulations! You are awarded Ż500 worth of CD vouchers or a Ż125 guaranteed gift and free entry into our weekly draw. Text MUSIC to 87066. Terms apply.,,,
ham,Notice: There was an administrative error. Please visit your local office for clarification. (Content sanitized),,,
ham,What time is your driving session on Friday? We will have an evaluation that day.,,,
spam,URGENT: This is our second attempt to contact you. Your Ż900 prize is still awaiting collection. Call 09061702893.,,,
ham,"Sorry, my roommates took a long time. Is it okay if I come by now?",,,
ham,"Okay, IÆll go home, check the schedule, and message you again. Xuhui is starting lessons on May 2nd at 8 AM.",,,
ham,He is just joking. DonÆt believe those messages; he sends them all the time.,,,
ham,I got a train seat; mine is the lower berth.,,,
ham,"ItÆs not fake. My friends received money; thatÆs why IÆm referring you. If you join using my link, you receive <#> rupees, and I receive <#> rupees. I can withdraw once my balance reaches <#> rupees.",,,
ham,Regarding the <#>GB item I saw a few days ago: the seller wants <#> for the Wi-Fi version and <#> for the 3G version. ThatÆs why I didnÆt respond.,,,
spam,"Enhance your phone with a Halloween-themed logo, picture message, and a free tone. Text CARD SPOOK to 8007.",,,
ham,"You already have a lot to deal with. It shouldnÆt be the childÆs responsibility to support the parent. IÆm here to support you, and I didnÆt mean to cause any distress.",,,
spam,Customer Loyalty Offer: The new Nokia 6650 is available from Ż10 at TXT Auction. Text START to 81151. Terms apply.,,,
ham,Very nice. Be ready on Thursday.,,,
spam,Your 2003 account statement shows 800 unredeemed points. Call 08715203685 with identifier code 4xx26. Expires 13/10/04.,,,
spam,You have a secret admirer who wishes to contact you. Call 09065171142 to learn more. Charges apply.,,,
ham,"IÆm extremely nervous, but IÆll try my best tomorrow. (Content sanitized)",,,
ham,"Where are you? It just sounds like Jan C, thatÆs all.",,,
ham,GumbyÆs has a special: a <#>-inch cheese pizza for $2. ThatÆs what weÆre doing tonight.,,,
ham,I slept poorly. I kept waking every two hours to check if my cat wanted to come inside. I worry when itÆs cold.,,,
ham,Someone called you a ōtoolö?,,,
ham,There is class today. There are no cancellations.,,,
spam,Free for the first week! Get Nokia ringtones weekly by texting NOKIA to 8077. Standard charges apply.,,,
spam,"In The Simpsons Movie released July 2007, which band appears at the start? A: Green Day, B: Blue Day, C: Red Day. Reply with A, B, or C.",,,
ham,I think 50 should be okay. He said plus or minus 10. Did you leave a space between the paragraphs?,,,
spam,"Hello, it has been three weeks without hearing from you. Would you like to reconnect? Standard charges apply.",,,
spam,URGENT: Your mobile number was awarded a Ż2000 bonus caller prize. This is our second attempt to reach you. Call 08718729755.,,,
ham,"IÆm doing alright, focusing on my goals. What about you? What are you doing next?",,,
ham,"Do whatever you decide, Juliana.",,,
ham,"Okay, IÆll log into Facebook in a few minutes.",,,
ham,"Monday is fine. Best option is affordable and good food, but more expensive places are okay too. Depends on whether you prefer Western or Chinese food. Which do you want?",,,
ham,IÆm coming home for dinner.,,,
spam,"URGENT: You have received one week of free entry into our Ż100,000 prize jackpot. Text CLAIM to 81010. Terms apply.",,,
ham,Nokia phones are great.,,,
ham,"Hi Wesley, how have you been?",,,
ham,Call me when you finish and I will come pick you up.,,,
ham,"I am on a train back from Northampton, so IÆm unable to.",,,
ham,I cannot pick up the phone right now. Please send a message.,,,
spam,(Bank of Granite issues Strong-Buy) Market update: Performance has increased significantly. Nasdaq symbol CDGT.,,,
spam,"18 days until the Euro 2004 kickoff. You will receive daily updates. To unsubscribe, text GET EURO STOP to 83222.",,,
ham,Watching TV now. I got a new job.,,,
ham,"Oh yes, I forgot. You can only take two items while shopping.",,,
ham,Understood. We will probably meet in about 20 minutes.,,,
spam,"For your chance to win Ż250 weekly, text ACTION to 80608. Terms apply.",,,
spam,Sports TV update: New Jersey Devils and Detroit Red Wings are playing. Reply END to stop.,,,
spam,Free for first week: Nokia ringtone available. Text NOKIA to 8077 for details.,,,
ham,"Good morning, please call me.",,,
spam,You have been selected to receive a Ż350 award. Please call 09066364311 to claim.,,,
spam,Get the official England ringtone or colour flag for todayÆs game. Text TONE or FLAG to 84199.,,,
ham,"Just saw your missed call, my dear brother. Have a great day.",,,
ham,I cannot pick up the phone right now. Please send a message.,,,
spam,"Urgent: Call 09066350750. Your complimentary 4-star Ibiza holiday or Ż10,000 cash is awaiting collection.",,,
ham,Great. I hope you are using your network connections as well Ś you never know which old acquaintance might help today.,,,
spam,"Urgent: Your mobile number has won a Ż2,000 bonus prize. This is our second attempt to reach you. Call 09066362220.",,,
ham,"Hi, CTS employee Ś how are you?",,,
ham,"Sorry, I will call later.",,,
spam,"You have won a Ż150 prize as a valued Vodafone customer. To collect, call 09061743386.",,,
ham,I accidentally brought them home in the box.,,,
ham,I just reached home. I am very tired. I will come tomorrow.,,,
spam,Sunshine Quiz: Win a Sony DVD player by answering which country the Algarve is in. Text your answer to 82277.,,,
spam,Think youÆre smart? Win Ż200 this week in our quiz. Text PLAY to 85222. Terms apply.,,,
spam,I have work tomorrow. Are you free to meet tonight FOR A REMARKABLE OFFER AT OUR STORE.,,,
ham,A thoughtful message: You are appreciated and valued as a friend.,,,
ham,That should help reduce some financial worries.,,,
ham,What about youŚwhat do you remember?,,,
spam,Urgent: Call 09061213237. Ż5000 cash or a 4-star holiday await collection. Terms apply.,,,
ham,I just dropped them off and I am on my way back.,,,
spam,I bought one ringtone and now receiving messages costing Ż3 offering more tones.,,,
spam,You are a Ż1000 winner or guaranteed prize recipient. Final attempt. Call 09071517866.,,,
spam,Urgent: We are trying to contact you. You have won a guaranteed Ż900 prize. Call 09061701939 with claim code S89.,,,
spam,Service message: Text STOP to end subscription. (Content sanitized),,,
ham,I keep ten rupees in my shelf. Buy two eggs.,,,
ham,"I am at Bruce & Fowler now, but IÆm in my momÆs car so I cannot park.",,,
spam,Update: Orange line rental half price for 12 months. Call MobileUpd8 on 08000839402.,,,
spam,Free for first week: Nokia tone subscription. Text NOKIA to 8007 for details.,,,
spam,Join the chatting service by texting GIRL or BLOKE with your name and age to 8007. (Sanitized),,,
spam,Everyone around seems to be responding well to you Ś you bring positivity.,,,
ham,You really sleep a lot. My dad woke me at 10-something for lunch.,,,
ham,Oh noģ had the tooth removed? Is it painful?,,,
ham,"Alright, IÆll bring my tape measure on Friday.",,,
ham,I might need to skip it. I am teaching until noon and then have a lecture at two.,,,
ham,"You know Telugu too? ThatÆs good. Okay, good night.",,,
spam,"For your chance to win Ż250 weekly, text PLAY to 83370. Terms apply.",,,
ham,Please take a couple of clear photos in bright light today. (Content sanitized),,,
ham,Where are you? What happened?,,,
ham,"Yeah, why not? Is the group all ready?",,,
spam,Last chance! Claim your Ż150 worth of discount vouchers today! Text SHOP to 85023 now! Subscription Ż3.00.,,,
spam,"Your B4U voucher for the week is MARSMS. Log onto the website for discount credit. To opt out, reply STOP.",,,
ham,Good morning! Have a wonderful day!,,,
spam,Missed call alert: These numbers called but did not leave a message.,,,
ham,How will I check on you now?,,,
spam,Free message: You have been awarded a free digital camera. Reply SNAP to collect your prize.,,,
spam,"Your ringtone service has changed! You have 25 free credits. Visit the website to choose your content. To stop, text CLUB STOP.",,,
spam,Congratulations! You are awarded Ż500 in CD gift vouchers or a guaranteed Ż125 gift. Text MUSIC to 87066.,,,
spam,You can win Ż100 in Music Gift Vouchers every week. Text DRAW to 87066 to participate.,,,
ham,"IÆm in school, but never mindŚjust eat first.",,,
spam,Please stop sending inappropriate content.,,,
spam,Customer service announcement: We recently attempted a delivery but were unable to complete it. Please call to reschedule.,,,
spam,Get the England ōThree Lionsö tone! Reply LIONM for mono or LIONP for poly.,,,
ham,"Yes, no need. IÆll just wait for the rain to stop.",,,
ham,I donÆt believe you. I think you told him.,,,
ham,Send me the new number.,,,
spam,Your 2003 account statement shows 800 unredeemed points. Call with the identifier code to claim.,,,
spam,Message removed due to inappropriate content.,,,
ham,Where is your memory when I need it?,,,
spam,Loans available for any purposeŚeven with bad credit. Tenants welcome. Visit the website or call now.,,,
ham,"Teach me the apps, please. When you come to college.",,,
ham,Sorry that took so long. IÆm on my way now.,,,
ham,"Somewhere out there beneath the pale moonlight, someone is thinking of you. Sweet dreams and good night.",,,
ham,ThereÆs no need for the medicine anymore.,,,
spam,Do you have what it takes to join the WRC Rally in Australia? Text RALLY LE to 61200 to enter!,,,
spam,Please call immediately. There is an urgent message waiting for you.,,,
ham,"Happy New Year, my number one!",,,
ham,ItÆs cool. Let me know before it begins around <number>. IÆll be out all day.,,,
spam,You are awarded a SiPix digital camera! Call to arrange delivery.,,,
ham,IÆll text now so he wonÆt think we forgot.,,,
ham,So whatÆs the decision?,,,
ham,Message removed due to inappropriate content.,,,
spam,"Win the newest ōHarry Potter and the Order of the Phoenixö (Book 5)! Reply HARRY, answer five questions, and get a chance to be among the first readers!",,,
ham,Meet me on Corporation Street outside Gapģ youÆll see what IÆm thinking!,,,
spam,"As one of our registered subscribers, you can enter the draw for a Ż100 gift voucher by replying ENTER. To unsubscribe, text STOP.",,,
ham,Mom wants to know where you are.,,,
ham,Beer later?,,,
spam,Can you get to the phone now? I want to chat and arrange a meeting. Call me.,,,
ham,Yes! I want to make you happy every night.,,,
ham,Some lesser-known facts about the Taj Mahalģ (list preserved),,,
spam,We tried to contact you regarding your reply to our offer of a video phone and half-price line rental.,,,
spam,We tried to contact you regarding your response to our offer of a new Nokia phone and camcorder.,,,
ham,"Alright, I took the medication. IÆm back now.",,,
ham,Where are you? Must I call you every time?,,,
ham,"Yes, next stop.",,,
ham,Message removed due to inappropriate content.,,,
ham,Talk to G and X about that.,,,
ham,Depends on where youÆre going.,,,
ham,"Hi, itÆs me. YouÆre probably having too much fun to see this message, but IÆm texting you because IÆm bored, and James has been annoying me all night.",,,
ham,I agree. So I can stop thinking about the iPadŚcan you please ask Macho the same question?,,,
spam,"Single people are waiting to connect! Text your AGE followed by your GENDER (M or F). For example: 23F. For gay men, text your AGE followed by G.",,,
ham,"Otherwise, I had a part-time tuition job.",,,
ham,"Nothing, I just received a message from an unknown number.",,,
ham,Where is mummyÆs boy? Is he being good or bad? Positive or negative? Why is mummy being made to wait?,,,
ham,Oh okayģ whatÆs your email?,,,
ham,This is my number Ś Vivek.,,,
ham,"Okay. IÆm at home, not dressed because IÆm resting Ś IÆm ill. IÆll speak to you later about timings.",,,
spam,"To review and keep the fantastic Nokia N-Gage game deck with Club Nokia, visit the website. To unsubscribe, reply OUT.",,,
ham,"I am in Tirupur; once you leave the office, call me.",,,
ham,"My life means a lot to me Ś not because I love my life, but because I love the people in it. The world calls them friends; I call them my world.",,,
ham,I have plenty of fuel money Ś want to go on a nature adventure with Galileo soon?,,,
ham,This all feels creepy and strange to me.,,,
spam,URGENT! We are trying to contact you. Last weekendÆs draw shows you have won a Ż900 guaranteed prize. Call with code K61. Valid 12 hours only.,,,
ham,"Sir, good morning. I hope you had a good weekend. I wanted to inform you that I was able to raise <number> from my dad. He said he will provide the rest by mid-February. This is still short, and I was hoping you could help. Have a good day. Ś Abiola",,,
ham,Still at the west coastģ It will take forever for you to come back.,,,
ham,IÆll get there tomorrow and send it to you.,,,
spam,Claim a Ż200 shopping spree! Call now to check if you have won.,,,
ham,My job profile seems like a BPO.,,,
ham,And taking <number> ibuprofens didnÆt help.,,,
ham,"I was thinking of throwing away your red, green, and black trainers to avoid carrying them back on the train.",,,
spam,"Urgent! Please call from a landline. Your complimentary 4-star Tenerife holiday or Ż5,000 cash awaits.",,,
spam,(Forwarded) Free entry into our Ż250 weekly competition! Send ENTER to 88877 now.,,,
spam,Free message: Text CALL to 86888 to claim your reward of three hours of talk time. Subscription applies unless you text STOP.,,,
ham,Mum is asking you to buy food on your way home.,,,
spam,Congratulations! You are awarded either Ż500 in CD gift vouchers and free entry to our Ż100 weekly draw. Text MUSIC to 87066.,,,
spam,"Message from 88066: You lost Ż3. For help, contact us.",,,
ham,"Thanks, dear. Good night.",,,
ham,I donÆt have any of your files in my bag. I was at work when you called. IÆll let you know if I find anything in my room.,,,
spam,"URGENT! Your mobile number has won a Ż2,000 bonus caller prize. This is the second attempt to reach you. Call ASAP.",,,
ham,"Hi Jon, Pete here. IÆve been to Spain recently and have some leftover money. Bill said you or your parents might be interested. I have 12,000 pesetas Ś around Ż48. Let me know.",,,
spam,YouÆve been selected to stay in one of 250 top British hotels Ś for free! Holiday valued at Ż350. Call to claim.,,,
spam,You have a secret admirer who wants to contact you. Call to find out who thinks youÆre special.,,,
spam,"TodayÆs selected Vodafone numbers ending in XXXX are eligible for a Ż350 award. If you have a match, call and quote claim code 3100.",,,
ham,Are you still coming tonight?,,,
spam,You are subscribed to the Mobile Content Service for Ż3 per 10 days until you text STOP to 82324.,,,
ham,Call me when youÆre done.,,,
ham,IÆm sorry about last night. It wasnÆt your faultŚit was me. Maybe it was just mood swings. Please forgive me.,,,
ham,IÆm good! IÆve been thinking about you.,,,
spam,Text BANNEDUK to 89555 to view content. Cost applies.,,,
ham,I need you here with me Ś I want to feel supported.,,,
ham,"IÆm at the customer location, IÆll call you.",,,
ham,"Just woke up. Wow, itÆs late Ś but I didnÆt fall asleep until <number> a.m.",,,
spam,Santa calling! Would your little ones like a call from Santa on Christmas Eve? Call to book your time.,,,
ham,IÆll pick you up around 6:45 p.m. That should give us enough time to get there and park.,,,
ham,I asked you a question a few hours ago. Here is the answer.,,,
ham,"Helloģ sorry, IÆm drunk. If this doesnÆt make sense, forgive me. I donÆt know how to dance to drum and bass! Had fun tonight. Ś Ros",,,
spam,"Congratulations! Thanks to a good friend, you have won the Ż2,000 Christmas prize. To claim, call now Ś national rate.",,,
spam,How does it take so little time for a child who fears the dark to become a teenager who wants to stay out all night? WE GOT YOU HIRE A DETECTIVE FOR YOUR KID ,,,
spam,"Banglorebae: Your order is on the way. You should receive a service message to download your content. If not, visit the website on your mobile service menu.",,,
ham,Going for dinner. Will message you afterward.,,,
ham,Weight loss! No more unhealthy habits. Make money on eBay or something. And give thanks to God.,,,
spam,Please call 08712402779 immediately; an urgent message is waiting for you.,,,
spam,"Try chat service with photo upload. Call 08718730666 (10p/min). To stop texts, call 08712460324.",,,
ham,"When you're hurt by someone close, talk it out with them. Sometimes a fight saves a relationship, but staying silent ends it. Good evening.",,,
spam,"We tried calling you regarding your reply to our SMS for a video mobile offer: 750 mins, unlimited texts, free camcorder. Reply or call now 08000930705. Delivery Thursday.",,,
spam,Your credits have been topped up. Your renewal PIN is tgxxrz.,,,
ham,Do you have a friend named Ashwini in your college?,,,
ham,"Hey, IÆll be late. IÆm at AMK. Need to get tea or coffee.",,,
ham,"Ladies first and genius second, okay.",,,
ham,You bought notes alreadyģ because I just remembered I got them.,,,
spam,"Dear Dave, this is your final notice to collect your 4? Tenerife holiday or Ż5000 cash award! Call 09061743806.",,,
ham,"Oh, did you charge the camera?",,,
spam,FREE for the first week! Top Nokia tone for your mobile every week. Text NOKIA to 87077.,,,
ham,Nothing special. What about you? Where are you?,,,
ham,"Sir, I sent you an email about logging into the USC payment portal. IÆll send another message explaining how things are back home. Have a great weekend.",,,
spam,URGENT! Your mobile number has been awarded a Ż2000 guaranteed prize. Call 09061790121. Claim code 3030. Valid 12 hrs only.,,,
ham,"Lol. The quality isn't bad at all, so IÆm not complaining.",,,
spam,Your TONEXS subscription has been renewed and youÆve been charged Ż4.50. You may choose 10 more tones this month.,,,
ham,"Mine here are all from China, so itÆs noisy.",,,
spam,BIG BROTHER ALERT! YouÆve been selected for Ż10k cash or a Ż150 voucher. Call 09064018838.,,,
ham,"Okay, I already planned. I will pick you.",,,
ham,Thanks for this. Hope you had a good day today.,,,
ham,"Okay, can I pick up another one when you're done?",,,
ham,"Behind every darkness, there is a shining light waiting to be found. Behind every best friend, there is trust and care.",,,
ham,Have a great time in Newquay! Send me a postcard! Look after all the girls while IÆm gone.,,,
ham,God bless. Get good sleepģ I will pray.,,,
spam,"Do you notice that when you're driving, anyone slower seems like an idiot and anyone faster seems like a maniac?",,,
ham,"Not much, just texting. How about you?",,,
spam,"WINNER! As a valued customer, youÆve been selected to receive a Ż900 reward! Call 09061701444.",,,
ham,"Petey boy, where are you? Me and your friends are at the Kingshead. Come down if you can. Ś Nic",,,
spam,Send a logo to your loved one Ś two names joined by a heart. Text LOVE NAME1 NAME2 MOBNO to 87077.,,,
ham,"Go tell her, or confront her firmly while sheÆs crossing.",,,
ham,Here there are lots of hairdressers from China.,,,
ham,Just sent again. Do you shout a lot when stressed?,,,
ham,I liked the new mobile.,,,
ham,"Yes, itÆs confirmed for you staying that weekend.",,,
spam,Free entry in a weekly contest to win FA Cup final tickets. Text FA to 87121.,,,
ham,"Yeah, I have a list with only you and Joanna if IÆm feeling very antisocial.",,,
ham,"Hi, Happy New Year. Not to intrude, but can you tell me how much tuition you paid last semester and this semester?",,,
spam,URGENT! Your mobile number was awarded a Ż2000 bonus prize! This is our second attempt to contact you. Call 0871-872-9758.,,,
ham,ItÆs okay; my arm feels weak because I got a shot. We can go another time.,,,
ham,Watching a Telugu movieģ what about you?,,,
spam,"You are guaranteed the latest Nokia phone, a 40GB iPod, or a Ż500 prize! Text COLLECT to 83355.",,,
spam,A Ż400 Christmas reward is waiting for you! Call 09066380611.,,,
ham,I donÆt have anybodyÆs number. I donÆt know a polite way to ask Alex.,,,
spam,Four months half-price Orange line rental and latest camera phones free. Call MobilesDirect on 08000938767.,,,
spam,New TextBuddy chat available. Text ONE name to 89693.,,,
ham,ay! You better not have said that to five other people.,,,
ham,"Oops, I was in the shower when you called. A parking garage collapsed at University Hospital. See, I'm not crazyŚthings like that do happen.",,,
ham,Great comedyģ can't stop laughing.,,,
ham,Not yet hadģ yes Sapna auntyÆs house yesterday. Chinnu is weak and looking a bit dull.,,,
spam,Had your mobile 11 months or more? You are entitled to update to the latest colour mobiles with camera for free! Call The Mobile Update Co FREE on 08002986030,,,
ham,"Okay then, are you coming to class tomorrow.",,,
spam,"Free entry into a weekly competition for a chance to win an iPod. Text POD to 80182 (std txt rate). T&C apply 08452810073, 18+",,,
ham,"The beauty of life is in the next second, which hides many secrets. I hope every second will be wonderful in your life. Good night.",,,
spam,YOU ARE CHOSEN TO RECEIVE A Ż350 AWARD! Please call 09066364311 to collect your award.,,,
ham,So what did the bank say about the money?,,,
ham,"But I canÆt go to your house empty-handed, right?",,,
spam,Bloomberg Message Center: Why wait? Apply for your future at their careers site.,,,
spam,"Get a free mobile video player and a free movie. To collect, text GO to 89105.",,,
spam,Get a brand new mobile phone by being an agent of The Mob! For more info text MAT to 87021.,,,
ham,Just getting back home.,,,
ham,ItÆs a little difficult but itÆs a simple way to enter this place.,,,
ham,"I will borrow your bag, okay.",,,
ham,WhatÆs up there? DonÆt you want to sleep?,,,
ham,Think positively. You will do well.,,,
ham,"IÆve been barred from all B&Q stores for life! Someone asked if I wanted decking, so I reacted.",,,
spam,This message is free. Welcome to the new and improved club. To unsubscribe reply STOP.,,,
spam,Do you want a new Nokia 3510i delivered tomorrow? With free minutes and texts? Reply or call 8000930705.,,,
ham,Small problem in auction; Punjab now asking Tiwary.,,,
ham,Okayģ where did you take the test?,,,
spam,"We have new local dates in your area. Reply DATE to start now, 18+.",,,
spam,T-Mobile customer: You may now claim your free camera phone upgrade and SIM card. Call 0845 021 3680.,,,
ham,Are you coming today for class.,,,
spam,You have a secret admirer. Reveal who it is by calling 09065174042. To opt out reply REVEAL STOP.,,,
ham,Haha cool cool.,,,
ham,Send his number and reply tomorrow morning explaining why you said that.,,,
spam,You have a secret admirer who wants to contact you. Call 09058094594.,,,
ham,Oh I thought you said she still doesnÆt believe.,,,
ham,"LOLģ no, I was just busy.",,,
spam,WELL DONE! Your 4? Costa Del Sol holiday or Ż5000 awaits collection. Call 09050090044.,,,
spam,"Reminder from O2: To get Ż2.50 free call credit reply with your name, house number, and postcode.",,,
ham,You will be in the place of that man.,,,
ham,IÆm okay. IÆll be fine soon. All the best.,,,
spam,"Do you realize that in about 40 years, we will have many old ladies with tattoos?",,,
spam,"Congratulations! You have WON the Ż2,000 Christmas prize. Call 08718726971 now.",,,
ham,"If IÆm not meeting you all, then IÆll go home. If you donÆt feel like coming, itÆs okay.",,,
spam,Free today: special picture offer. Text PIC to 89080.,,,
ham,How long does ApplebeeÆs take?,,,
spam,Last chance to claim your Ż150 discount vouchers. Text YES to 85023 now.,,,
ham,"You never tell me, so how would I knowģ IÆm not at home in the afternoon.",,,
spam,HMV BONUS SPECIAL: Ż500 of genuine HMV vouchers to be won. Send HMV to 86688.,,,
ham,I am only searching for a good dual SIM mobile.,,,
spam,Want location alerts sent directly to your mobile? Text MOAN to 69888 (18+).,,,
spam,You are awarded a SiPix digital camera! Call 09061221061.,,,
spam,YouÆve been awarded Ż50 to play for instant cash. Call 08715203028.,,,
spam,"Sunshine Holidays: To claim your holiday, send a stamped envelope to Drinks on Us UK.",,,
ham,"Sorry, IÆll call later, IÆm in a meeting.",,,
spam,Free message: Single? Find a partner in your area! Send CHAT to 62220.,,,
spam,"Your cash balance is currently Ż500. To collect, send COLLECT to 83600.",,,
ham,I know you are busy. IÆm trying not to bother you. I have exams and then car work. Have a good day.,,,
ham,Your opinion about me? Please reply with the number.,,,
